InvoiceNo,StockCode,Description,Quantity,InvoiceDate,UnitPrice,CustomerID,Country
571442,22558,CLOTHES PEGS RETROSPOT PACK 24 ,3,10/17/2011 13:39,1.65,17049,United Kingdom
571442,22112,CHOCOLATE HOT WATER BOTTLE,2,10/17/2011 13:39,4.95,17049,United Kingdom
571442,16169E,WRAP 50'S  CHRISTMAS,25,10/17/2011 13:39,0.42,17049,United Kingdom
571444,23234,BISCUIT TIN VINTAGE CHRISTMAS,6,10/17/2011 13:44,2.89,18179,United Kingdom
571446,23173,REGENCY TEAPOT ROSES ,36,10/17/2011 13:46,8.15,14911,EIRE
571456,23298,SPOTTY BUNTING,1,10/17/2011 13:57,4.95,16729,United Kingdom
571461,85123A,WHITE HANGING HEART T-LIGHT HOLDER,1,10/17/2011 14:12,2.95,16932,United Kingdom
571463,22554,PLASTERS IN TIN WOODLAND ANIMALS,12,10/17/2011 14:23,1.65,16463,United Kingdom
571465,22337,ANGEL DECORATION PAINTED ZINC ,8,10/17/2011 14:29,0.65,14830,United Kingdom
571474,22560,TRADITIONAL MODELLING CLAY,24,10/17/2011 14:41,1.25,16389,United Kingdom
571474,22489,PACK OF 12 TRADITIONAL CRAYONS,24,10/17/2011 14:41,0.42,16389,United Kingdom
571475,23376,PACK OF 12 VINTAGE CHRISTMAS TISSUE,12,10/17/2011 14:42,0.39,15033,United Kingdom
571475,21892,TRADITIONAL WOODEN CATCH CUP GAME ,1,10/17/2011 14:42,1.25,15033,United Kingdom
571476,85034A,3 GARDENIA MORRIS BOXED CANDLES,1,10/17/2011 14:51,1.25,13546,United Kingdom
571477,22128,PARTY CONES CANDY ASSORTED,12,10/17/2011 14:54,1.25,12794,Portugal
571498,23213,STAR WREATH DECORATION WITH BELL,1,10/17/2011 15:06,1.25,17841,United Kingdom
571502,23300,GARDENERS KNEELING PAD CUP OF TEA ,24,10/17/2011 15:18,1.65,14422,United Kingdom
571505,22910,PAPER CHAIN KIT VINTAGE CHRISTMAS,1,10/17/2011 15:19,2.95,17244,United Kingdom
571505,21034,REX CASH+CARRY JUMBO SHOPPER,2,10/17/2011 15:19,0.95,17244,United Kingdom
571505,22465,HANGING METAL STAR LANTERN,12,10/17/2011 15:19,1.65,17244,United Kingdom
571509,23313,VINTAGE CHRISTMAS BUNTING,1,10/17/2011 15:28,4.95,13110,United Kingdom
571546,22699,ROSES REGENCY TEACUP AND SAUCER ,12,10/17/2011 17:24,2.95,17920,United Kingdom
571548,22144,CHRISTMAS CRAFT LITTLE FRIENDS,40,10/18/2011 7:56,1.85,15505,United Kingdom
571552,22952,60 CAKE CASES VINTAGE CHRISTMAS,24,10/18/2011 8:42,0.55,16848,United Kingdom
571556,22326,ROUND SNACK BOXES SET OF4 WOODLAND ,12,10/18/2011 9:24,2.95,12662,Germany
571560,23531,WALL ART BIG LOVE ,3,10/18/2011 9:54,6.95,14897,United Kingdom
571562,23157,SET OF 6 NATIVITY MAGNETS ,24,10/18/2011 10:04,2.08,14156,EIRE
571566,21500,PINK POLKADOT WRAP ,25,10/18/2011 10:19,0.42,13594,United Kingdom
571595,22379,RECYCLING BAG RETROSPOT ,30,10/18/2011 10:52,2.1,15971,United Kingdom
571629,23406,HOME SWEET HOME KEY HOLDER,2,10/18/2011 11:18,6.25,13362,United Kingdom
571629,21418,STARFISH SOAP DISH,6,10/18/2011 11:18,2.55,13362,United Kingdom
571629,23355,HOT WATER BOTTLE KEEP CALM,8,10/18/2011 11:18,4.95,13362,United Kingdom
571629,20982,12 PENCILS TALL TUBE SKULLS,12,10/18/2011 11:18,0.85,13362,United Kingdom
571641,22161,HEART DECORATION RUSTIC HANGING ,24,10/18/2011 12:07,0.19,17135,United Kingdom
571653,85034B,3 WHITE CHOC MORRIS BOXED CANDLES,24,10/18/2011 12:17,1.25,14298,United Kingdom
571653,35953,FOLKART STAR CHRISTMAS DECORATIONS,48,10/18/2011 12:17,0.39,14298,United Kingdom
571653,22603,CHRISTMAS RETROSPOT TREE WOOD,12,10/18/2011 12:17,0.72,14298,United Kingdom
571653,23123,COCKTAIL SWORDS 50 PIECES,48,10/18/2011 12:17,0.72,14298,United Kingdom
571653,72817,SET OF 2 CHRISTMAS DECOUPAGE CANDLE,48,10/18/2011 12:17,0.79,14298,United Kingdom
571653,21618,4 WILDFLOWER BOTANICAL CANDLES,24,10/18/2011 12:17,1.25,14298,United Kingdom
571653,23263,SET OF 3 WOODEN HEART DECORATIONS,48,10/18/2011 12:17,1.04,14298,United Kingdom
571653,23470,CARD HOLDER LOVE BIRD LARGE ,6,10/18/2011 12:17,5.39,14298,United Kingdom
571653,21812,GARLAND WITH HEARTS AND BELLS,6,10/18/2011 12:17,4.25,14298,United Kingdom
571653,22465,HANGING METAL STAR LANTERN,24,10/18/2011 12:17,1.45,14298,United Kingdom
571653,85111,SILVER GLITTER FLOWER VOTIVE HOLDER,72,10/18/2011 12:17,0.29,14298,United Kingdom
571653,22579,WOODEN TREE CHRISTMAS SCANDINAVIAN,72,10/18/2011 12:17,0.29,14298,United Kingdom
571654,85035C,ROSE 3 WICK MORRIS BOX CANDLE,1,10/18/2011 12:17,1.25,18118,United Kingdom
571656,21914,BLUE HARMONICA IN BOX ,3,10/18/2011 12:43,1.25,16393,United Kingdom
571660,23270,SET OF 2 CERAMIC PAINTED HEARTS ,12,10/18/2011 12:49,1.45,16191,United Kingdom
571660,22988,SOLDIERS EGG CUP ,12,10/18/2011 12:49,1.25,16191,United Kingdom
571660,84970S,HANGING HEART ZINC T-LIGHT HOLDER,12,10/18/2011 12:49,0.85,16191,United Kingdom
571665,23438, RED SPOT GIFT BAG LARGE,12,10/18/2011 12:59,1.25,12540,Spain
571669,22817,CARD SUKI BIRTHDAY,12,10/18/2011 13:11,0.42,17758,United Kingdom
571669,84032A,CHARLIE+LOLA PINK HOT WATER BOTTLE,3,10/18/2011 13:11,2.95,17758,United Kingdom
571669,21788,KIDS RAIN MAC BLUE,3,10/18/2011 13:11,0.85,17758,United Kingdom
571670,21985,PACK OF 12 HEARTS DESIGN TISSUES ,24,10/18/2011 13:12,0.39,12611,Italy
571670,23296,SET OF 6 TEA TIME BAKING CASES,8,10/18/2011 13:12,1.25,12611,Italy
571670,22326,ROUND SNACK BOXES SET OF4 WOODLAND ,6,10/18/2011 13:12,2.95,12611,Italy
571671,23355,HOT WATER BOTTLE KEEP CALM,4,10/18/2011 13:15,4.95,16940,United Kingdom
571676,21901,"KEY FOB , BACK DOOR ",1,10/18/2011 13:29,0.65,16910,United Kingdom
571676,35970,ZINC FOLKART SLEIGH BELLS,1,10/18/2011 13:29,1.69,16910,United Kingdom
571676,23329,DECORATIVE WICKER HEART LARGE,2,10/18/2011 13:29,1.65,16910,United Kingdom
571676,35648,VINTAGE BEAD PINK PURSE ,2,10/18/2011 13:29,0.83,16910,United Kingdom
571681,17012B,ORIGAMI JASMINE INCENSE/CANDLE SET,24,10/18/2011 13:44,0.85,16734,United Kingdom
571682,23176,ABC TREASURE BOOK BOX ,1,10/18/2011 14:00,2.25,14179,United Kingdom
571682,21899,GARAGE KEY FOB,4,10/18/2011 14:00,0.65,14179,United Kingdom
571682,22654,DELUXE SEWING KIT ,1,10/18/2011 14:00,5.95,14179,United Kingdom
571682,84849D,HOT BATHS SOAP HOLDER,3,10/18/2011 14:00,1.69,14179,United Kingdom
571682,20679,EDWARDIAN PARASOL RED,1,10/18/2011 14:00,5.95,14179,United Kingdom
571683,23243,SET OF TEA COFFEE SUGAR TINS PANTRY,4,10/18/2011 14:07,4.95,15140,United Kingdom
571684,23267,SET OF 4 SANTA PLACE SETTINGS,1,10/18/2011 14:11,1.25,16730,United Kingdom
571684,23271,CHRISTMAS TABLE SILVER CANDLE SPIKE,6,10/18/2011 14:11,0.83,16730,United Kingdom
571685,37446,MINI CAKE STAND WITH HANGING CAKES,24,10/18/2011 14:15,1.45,12863,United Kingdom
571694,22535,MAGIC DRAWING SLATE BUNNIES ,24,10/18/2011 14:44,0.42,13308,United Kingdom
571696,84946,ANTIQUE SILVER T-LIGHT GLASS,12,10/18/2011 14:47,1.25,15604,United Kingdom
571701,22602,RETROSPOT WOODEN HEART DECORATION,24,10/18/2011 15:05,0.85,14639,United Kingdom
571705,22572,ROCKING HORSE GREEN CHRISTMAS ,12,10/18/2011 15:22,0.85,12360,Austria
571705,72817,SET OF 2 CHRISTMAS DECOUPAGE CANDLE,24,10/18/2011 15:22,0.79,12360,Austria
571706,85034C,3 ROSE MORRIS BOXED CANDLES,24,10/18/2011 15:26,1.25,15144,United Kingdom
571710,22383,LUNCH BAG SUKI DESIGN ,10,10/18/2011 15:54,1.65,13032,United Kingdom
571712,22899,CHILDREN'S APRON DOLLY GIRL ,4,10/18/2011 16:46,2.1,14056,United Kingdom
571712,22554,PLASTERS IN TIN WOODLAND ANIMALS,3,10/18/2011 16:46,1.65,14056,United Kingdom
571715,21977,PACK OF 60 PINK PAISLEY CAKE CASES,6,10/18/2011 17:04,0.55,17576,United Kingdom
571717,21992,VINTAGE PAISLEY STATIONERY SET,1,10/18/2011 17:10,1.25,14381,United Kingdom
571717,22113,GREY HEART HOT WATER BOTTLE,1,10/18/2011 17:10,4.25,14381,United Kingdom
571726,23224,CHERUB HEART DECORATION GOLD,12,10/19/2011 9:00,0.83,16191,United Kingdom
571726,23270,SET OF 2 CERAMIC PAINTED HEARTS ,12,10/19/2011 9:00,1.45,16191,United Kingdom
571726,23567,EGG CUP HENRIETTA HEN PINK,12,10/19/2011 9:00,1.25,16191,United Kingdom
571726,22983,CARD BILLBOARD FONT,12,10/19/2011 9:00,0.42,16191,United Kingdom
571730,22969,HOMEMADE JAM SCENTED CANDLES,12,10/19/2011 9:48,1.45,16851,United Kingdom
571745,23319,BOX OF 6 MINI 50'S CRACKERS,6,10/19/2011 10:48,2.49,14911,EIRE
571747,22537,MAGIC DRAWING SLATE DINOSAUR,24,10/19/2011 10:59,0.42,13849,United Kingdom
571748,22300,COFFEE MUG DOG + BALL DESIGN,12,10/19/2011 11:13,2.55,18077,United Kingdom
571779,22434,BALLOON PUMP WITH 10 BALLOONS,1,10/19/2011 11:27,1.95,12748,United Kingdom
571809,22720,SET OF 3 CAKE TINS PANTRY DESIGN ,1,10/19/2011 11:44,4.95,15039,United Kingdom
571824,21238,RED RETROSPOT CUP,8,10/19/2011 11:49,0.85,12472,Germany
571828,23343,JUMBO BAG VINTAGE CHRISTMAS ,5,10/19/2011 11:52,2.08,16440,United Kingdom
571828,23198,PANTRY MAGNETIC  SHOPPING LIST,6,10/19/2011 11:52,1.45,16440,United Kingdom
571837,23389,SPACEBOY MINI BACKPACK,2,10/19/2011 12:11,4.15,16470,United Kingdom
571837,35591T,TURQUOISE CHRISTMAS TREE ,1,10/19/2011 12:11,1.25,16470,United Kingdom
571837,22630,DOLLY GIRL LUNCH BOX,3,10/19/2011 12:11,1.95,16470,United Kingdom
571837,23504,PLAYING CARDS JUBILEE UNION JACK,2,10/19/2011 12:11,1.25,16470,United Kingdom
571844,23356,LOVE HOT WATER BOTTLE,24,10/19/2011 12:30,4.95,17101,United Kingdom
571845,22153,ANGEL DECORATION STARS ON DRESS,4,10/19/2011 12:34,0.42,16869,United Kingdom
571846,22674,FRENCH TOILET SIGN BLUE METAL,7,10/19/2011 12:35,1.25,17841,United Kingdom
571847,22141,CHRISTMAS CRAFT TREE TOP ANGEL,6,10/19/2011 12:39,2.1,15220,United Kingdom
571849,23500,KEY RING BASEBALL BOOT ASSORTED ,20,10/19/2011 12:52,1.25,12841,United Kingdom
571850,22573,STAR WOODEN CHRISTMAS DECORATION,10,10/19/2011 12:54,0.85,14698,United Kingdom
571850,23247,BISCUIT TIN 50'S CHRISTMAS,4,10/19/2011 12:54,2.89,14698,United Kingdom
571851,22778,GLASS CLOCHE SMALL,4,10/19/2011 13:02,3.95,12596,Spain
571853,23554,LANDMARK FRAME OXFORD STREET,3,10/19/2011 13:23,12.5,14306,United Kingdom
571864,21481,FAWN BLUE HOT WATER BOTTLE,36,10/19/2011 13:49,3.39,12731,France
571883,21742,LARGE ROUND WICKER PLATTER ,2,10/19/2011 13:58,5.95,14704,United Kingdom
571883,22152,PLACE SETTING WHITE STAR,8,10/19/2011 13:58,0.42,14704,United Kingdom
571883,22208,WOOD STAMP SET THANK YOU,1,10/19/2011 13:58,0.83,14704,United Kingdom
571883,23416,CHAMBRE HOOK,2,10/19/2011 13:58,1.65,14704,United Kingdom
571883,22161,HEART DECORATION RUSTIC HANGING ,2,10/19/2011 13:58,0.19,14704,United Kingdom
571883,23493,VINTAGE DOILY TRAVEL SEWING KIT,5,10/19/2011 13:58,1.95,14704,United Kingdom
571883,22598,CHRISTMAS MUSICAL ZINC TREE,19,10/19/2011 13:58,0.29,14704,United Kingdom
571890,22621,TRADITIONAL KNITTING NANCY,12,10/19/2011 14:05,1.65,16826,United Kingdom
571890,23399,HOME SWEET HOME HANGING HEART,12,10/19/2011 14:05,0.85,16826,United Kingdom
571895,10135,COLOURING PENCILS BROWN TUBE,20,10/19/2011 14:14,1.25,17824,United Kingdom
571905,84012,MAGIC SHEEP WOOL GROWING FROM PAPER,24,10/19/2011 14:51,0.85,12370,Cyprus
571909,22670,FRENCH WC SIGN BLUE METAL,1,10/19/2011 15:08,1.25,15006,United Kingdom
571909,22098,BOUDOIR SQUARE TISSUE BOX,1,10/19/2011 15:08,0.39,15006,United Kingdom
571909,22996,TRAVEL CARD WALLET VINTAGE TICKET,1,10/19/2011 15:08,0.42,15006,United Kingdom
571913,22966,GINGERBREAD MAN COOKIE CUTTER,12,10/19/2011 15:29,1.25,18210,United Kingdom
571917,22678,FRENCH BLUE METAL DOOR SIGN 3,10,10/19/2011 15:46,1.25,13078,United Kingdom
571934,22586,FELTCRAFT HAIRBAND PINK AND BLUE,12,10/20/2011 8:21,0.85,16170,United Kingdom
571937,22526,WHEELBARROW FOR CHILDREN ,1,10/20/2011 9:28,12.75,14911,EIRE
571937,22266,EASTER DECORATION HANGING BUNNY,640,10/20/2011 9:28,0.19,14911,EIRE
571937,20996,JAZZ HEARTS ADDRESS BOOK,24,10/20/2011 9:28,0.19,14911,EIRE
571939,22834,HAND WARMER BABUSHKA DESIGN,12,10/20/2011 9:40,2.1,16260,United Kingdom
571940,23145,ZINC T-LIGHT HOLDER STAR LARGE,12,10/20/2011 9:57,0.95,15301,United Kingdom
571941,23556,LANDMARK FRAME COVENT GARDEN ,3,10/20/2011 10:04,12.5,14261,United Kingdom
571943,23024,LARGE BONNE JAM JAR  T-LIGHT HOLDER,10,10/20/2011 10:10,2.89,14638,United Kingdom
571944,21810,CHRISTMAS HANGING STAR WITH BELL,48,10/20/2011 10:15,0.39,13755,United Kingdom
571944,22899,CHILDREN'S APRON DOLLY GIRL ,6,10/20/2011 10:15,2.1,13755,United Kingdom
571965,21500,PINK POLKADOT WRAP ,25,10/20/2011 10:41,0.42,17238,United Kingdom
572021,21136,PAINTED METAL PEARS ASSORTED,24,10/20/2011 10:57,1.69,15664,United Kingdom
572028,22697,GREEN REGENCY TEACUP AND SAUCER,6,10/20/2011 11:47,2.95,15296,United Kingdom
572037,23350,ROLL WRAP VINTAGE SPOT ,36,10/20/2011 12:07,1.25,17365,United Kingdom
572037,23476,WOODLAND LARGE RED FELT HEART,12,10/20/2011 12:07,1.25,17365,United Kingdom
572045,22667,RECIPE BOX RETROSPOT ,2,10/20/2011 12:11,2.95,14527,United Kingdom
572045,35599D,PINK AND WHITE CHRISTMAS TREE 120CM,3,10/20/2011 12:11,1.95,14527,United Kingdom
572047,23419,HOME SWEET HOME BOTTLE ,9,10/20/2011 12:13,2.08,16474,United Kingdom
572047,21172,PARTY METAL SIGN ,2,10/20/2011 12:13,1.45,16474,United Kingdom
572052,22595,GINGHAM HEART DECORATION,1728,10/20/2011 12:26,0.72,14646,Netherlands
572055,22108,PING! MICROWAVE PLATE,1,10/20/2011 12:34,3.75,17346,United Kingdom
572060,22892,SET OF SALT AND PEPPER TOADSTOOLS,12,10/20/2011 12:52,1.25,12569,Germany
572063,85170B,SET/6 BLACK BIRD T-LIGHT CANDLES,1,10/20/2011 12:57,2.1,14606,United Kingdom
572065,22553,PLASTERS IN TIN SKULLS,3,10/20/2011 13:06,1.65,12556,Spain
572065,23103,JINGLE BELL HEART DECORATION,6,10/20/2011 13:06,1.65,12556,Spain
572066,21204,DAISIES  HONEYCOMB GARLAND ,12,10/20/2011 13:07,1.65,15159,United Kingdom
572066,22041,"RECORD FRAME 7"" SINGLE SIZE ",12,10/20/2011 13:07,2.55,15159,United Kingdom
572066,21212,PACK OF 72 RETROSPOT CAKE CASES,24,10/20/2011 13:07,0.55,15159,United Kingdom
572066,22083,PAPER CHAIN KIT RETROSPOT,12,10/20/2011 13:07,2.95,15159,United Kingdom
572066,21818,GLITTER HEART DECORATION,36,10/20/2011 13:07,0.39,15159,United Kingdom
572067,23200,JUMBO BAG PEARS,10,10/20/2011 13:13,2.08,16099,United Kingdom
572069,22731,3D CHRISTMAS STAMPS STICKERS ,18,10/20/2011 13:24,1.25,14911,EIRE
572069,21822,GLITTER CHRISTMAS TREE WITH BELLS,12,10/20/2011 13:24,0.79,14911,EIRE
572073,21873,IF YOU CAN'T STAND THE HEAT MUG,1,10/20/2011 13:46,1.25,13263,United Kingdom
572074,22621,TRADITIONAL KNITTING NANCY,4,10/20/2011 13:54,1.65,16284,United Kingdom
572076,23130,MISTLETOE HEART WREATH GREEN,4,10/20/2011 14:01,4.15,13761,United Kingdom
572076,20971,PINK BLUE FELT CRAFT TRINKET BOX,12,10/20/2011 14:01,1.25,13761,United Kingdom
572076,23534,STOP FOR TEA WALL ART,3,10/20/2011 14:01,5.95,13761,United Kingdom
572079,23438, RED SPOT GIFT BAG LARGE,12,10/20/2011 14:11,1.25,14484,United Kingdom
572081,23378,PACK OF 12 50'S CHRISTMAS TISSUES,24,10/20/2011 14:13,0.39,16592,United Kingdom
572082,22141,CHRISTMAS CRAFT TREE TOP ANGEL,12,10/20/2011 14:18,2.1,17672,United Kingdom
572082,22950,36 DOILIES VINTAGE CHRISTMAS,12,10/20/2011 14:18,1.45,17672,United Kingdom
572082,22846,BREAD BIN DINER STYLE RED ,1,10/20/2011 14:18,16.95,17672,United Kingdom
572082,23189,SET OF 12 FORK CANDLES,12,10/20/2011 14:18,2.89,17672,United Kingdom
572086,22731,3D CHRISTMAS STAMPS STICKERS ,18,10/20/2011 14:30,1.25,13897,United Kingdom
572087,23445,ICE CREAM BUBBLES,20,10/20/2011 14:30,0.83,12683,France
572087,21123,SET/10 IVORY POLKADOT PARTY CANDLES,24,10/20/2011 14:30,1.25,12683,France
572087,23159,SET OF 5 PANCAKE DAY MAGNETS,12,10/20/2011 14:30,2.08,12683,France
572090,22097,SWALLOW SQUARE TISSUE BOX,1,10/20/2011 14:33,0.39,13573,United Kingdom
572100,23531,WALL ART BIG LOVE ,6,10/20/2011 15:45,6.95,16705,United Kingdom
572103,22982,PANTRY PASTRY BRUSH,1,10/20/2011 15:57,1.25,17571,United Kingdom
572103,23126,FELTCRAFT GIRL AMELIE KIT,1,10/20/2011 15:57,4.95,17571,United Kingdom
572103,84006,MAGIC TREE -PAPER FLOWERS,1,10/20/2011 15:57,0.85,17571,United Kingdom
572103,20869,GOLD FABRIC MIRROR,1,10/20/2011 15:57,0.39,17571,United Kingdom
572103,21439,BASKET OF TOADSTOOLS,1,10/20/2011 15:57,1.25,17571,United Kingdom
572106,22587,FELTCRAFT HAIRBAND RED AND BLUE,12,10/20/2011 17:04,0.85,15058,United Kingdom
572108,84347,ROTATING SILVER ANGELS T-LIGHT HLDR,12,10/20/2011 18:08,2.55,15814,United Kingdom
572121,20829,GLITTER HANGING BUTTERFLY STRING,18,10/20/2011 19:51,2.1,17092,United Kingdom
572121,23293,SET OF 12 FAIRY CAKE BAKING CASES,8,10/20/2011 19:51,0.83,17092,United Kingdom
572122,23396,LE JARDIN BOTANIQUE CUSHION COVER,8,10/21/2011 8:24,3.75,15969,United Kingdom
572127,22114,HOT WATER BOTTLE TEA AND SYMPATHY,8,10/21/2011 9:20,4.25,14911,EIRE
572182,23350,ROLL WRAP VINTAGE SPOT ,12,10/21/2011 10:32,1.25,13588,United Kingdom
572183,21172,PARTY METAL SIGN ,12,10/21/2011 10:50,1.45,16153,United Kingdom
572183,22382,LUNCH BAG SPACEBOY DESIGN ,10,10/21/2011 10:50,1.65,16153,United Kingdom
572192,82482,WOODEN PICTURE FRAME WHITE FINISH,6,10/21/2011 11:30,2.95,18118,United Kingdom
572194,21162,TOXIC AREA  DOOR HANGER ,2,10/21/2011 11:43,0.39,17832,United Kingdom
572196,23531,WALL ART BIG LOVE ,120,10/21/2011 11:54,4.77,18102,United Kingdom
572203,23002,TRAVEL CARD WALLET SKULLS,24,10/21/2011 12:05,0.42,17068,United Kingdom
572203,20661,BLUE POLKADOT PURSE ,5,10/21/2011 12:05,2.95,17068,United Kingdom
572213,22046,TEA PARTY  WRAPPING PAPER ,25,10/21/2011 12:44,0.42,15358,United Kingdom
572213,22454,MEASURING TAPE BABUSHKA RED,6,10/21/2011 12:44,2.95,15358,United Kingdom
572214,72351A,SET/6 TURQUOISE BUTTERFLY T-LIGHTS,6,10/21/2011 12:50,2.1,16918,United Kingdom
572215,23328,SET 6 SCHOOL MILK BOTTLES IN CRATE,24,10/21/2011 12:52,3.39,12646,USA
572215,21122,SET/10 PINK POLKADOT PARTY CANDLES,48,10/21/2011 12:52,1.25,12646,USA
572216,22340,NOEL GARLAND PAINTED ZINC ,2,10/21/2011 12:56,0.39,16015,United Kingdom
572216,20727,LUNCH BAG  BLACK SKULL.,4,10/21/2011 12:56,1.65,16015,United Kingdom
572216,21813,GARLAND WITH STARS AND BELLS,2,10/21/2011 12:56,4.95,16015,United Kingdom
572219,22673,FRENCH GARDEN SIGN BLUE METAL,1,10/21/2011 13:17,1.25,17463,United Kingdom
572219,23202,JUMBO BAG VINTAGE LEAF,2,10/21/2011 13:17,2.08,17463,United Kingdom
572227,23499,SET 12 VINTAGE DOILY CHALK ,8,10/21/2011 14:01,0.42,15051,United Kingdom
572227,21993,FLORAL FOLK STATIONERY SET,6,10/21/2011 14:01,1.25,15051,United Kingdom
572229,22698,PINK REGENCY TEACUP AND SAUCER,6,10/21/2011 14:23,2.95,14329,United Kingdom
572235,23530,WALL ART ONLY ONE PERSON ,6,10/21/2011 14:42,4.95,16293,United Kingdom
572241,22114,HOT WATER BOTTLE TEA AND SYMPATHY,4,10/21/2011 15:20,4.25,12712,Germany
572242,84836,ZINC METAL HEART DECORATION,12,10/21/2011 15:36,1.25,15677,United Kingdom
572243,22460,EMBOSSED GLASS TEALIGHT HOLDER,6,10/21/2011 15:43,1.25,17361,United Kingdom
572274,23245,SET OF 3 REGENCY CAKE TINS,2,10/21/2011 16:48,4.95,14031,United Kingdom
572280,22621,TRADITIONAL KNITTING NANCY,4,10/23/2011 11:05,1.65,16007,United Kingdom
572280,21989,PACK OF 20 SKULL PAPER NAPKINS,1,10/23/2011 11:05,0.85,16007,United Kingdom
572281,48194,DOORMAT HEARTS,2,10/23/2011 11:10,8.25,17211,United Kingdom
572282,22197,POPCORN HOLDER,6,10/23/2011 11:39,0.85,17634,United Kingdom
572282,22355,CHARLOTTE BAG SUKI DESIGN,2,10/23/2011 11:39,0.85,17634,United Kingdom
572283,22271,FELTCRAFT DOLL ROSIE,1,10/23/2011 11:42,2.95,15000,United Kingdom
572283,21114,LAVENDER SCENTED FABRIC HEART,10,10/23/2011 11:42,1.25,15000,United Kingdom
572284,21704,BAG 250g SWIRLY MARBLES,3,10/23/2011 12:08,0.85,16744,United Kingdom
572284,21578,WOODLAND DESIGN  COTTON TOTE BAG,2,10/23/2011 12:08,2.25,16744,United Kingdom
572284,22382,LUNCH BAG SPACEBOY DESIGN ,6,10/23/2011 12:08,1.65,16744,United Kingdom
572287,23486,ANTIQUE HEART SHELF UNIT,1,10/23/2011 12:26,16.65,15584,United Kingdom
572288,47566B,TEA TIME PARTY BUNTING,5,10/23/2011 12:28,4.95,17377,United Kingdom
572291,23320,GIANT 50'S CHRISTMAS CRACKER,1,10/23/2011 12:46,2.89,16931,United Kingdom
572291,22599,CHRISTMAS MUSICAL ZINC STAR,6,10/23/2011 12:46,0.29,16931,United Kingdom
572291,23088,ZINC HEART FLOWER T-LIGHT HOLDER,6,10/23/2011 12:46,1.25,16931,United Kingdom
572294,84987,SET OF 36 TEATIME PAPER DOILIES,6,10/23/2011 13:10,1.45,13471,United Kingdom
572294,21154,RED RETROSPOT OVEN GLOVE ,3,10/23/2011 13:10,1.25,13471,United Kingdom
572295,21481,FAWN BLUE HOT WATER BOTTLE,2,10/23/2011 13:49,3.75,16686,United Kingdom
572295,21731,RED TOADSTOOL LED NIGHT LIGHT,2,10/23/2011 13:49,1.65,16686,United Kingdom
572295,23390,DOLLY GIRL MINI BACKPACK,2,10/23/2011 13:49,4.15,16686,United Kingdom
572295,84378,SET OF 3 HEART COOKIE CUTTERS,2,10/23/2011 13:49,1.45,16686,United Kingdom
572295,22550,HOLIDAY FUN LUDO,2,10/23/2011 13:49,3.75,16686,United Kingdom
572296,23239,SET OF 4 KNICK KNACK TINS POPPIES,2,10/23/2011 14:28,4.15,13598,United Kingdom
572302,22900,SET 2 TEA TOWELS I LOVE LONDON ,1,10/23/2011 14:47,3.25,15427,United Kingdom
572302,84519B,CARROT CHARLIE+LOLA COASTER SET,3,10/23/2011 14:47,1.25,15427,United Kingdom
572303,82486,3 DRAWER ANTIQUE WHITE WOOD CABINET,2,10/23/2011 14:56,8.95,18109,United Kingdom
572304,23140,TRIPLE WIRE HOOK IVORY HEART,12,10/23/2011 15:07,4.15,17131,United Kingdom
572304,85049G,CHOCOLATE BOX RIBBONS ,5,10/23/2011 15:07,1.25,17131,United Kingdom
572304,82578,KITCHEN METAL SIGN,25,10/23/2011 15:07,0.55,17131,United Kingdom
572306,22467,GUMBALL COAT RACK,3,10/23/2011 15:11,2.55,17841,United Kingdom
572306,22428,ENAMEL FIRE BUCKET CREAM,3,10/23/2011 15:11,6.95,17841,United Kingdom
572306,71270,PHOTO CLIP LINE,1,10/23/2011 15:11,1.25,17841,United Kingdom
572307,22780,LIGHT GARLAND BUTTERFILES PINK,2,10/23/2011 15:23,4.25,16905,United Kingdom
572307,23482,PEARLISED IVORY HEART LARGE ,12,10/23/2011 15:23,1.65,16905,United Kingdom
572308,23569,TRADTIONAL ALPHABET STAMP SET,1,10/23/2011 15:27,4.95,12748,United Kingdom
572309,23102,SILVER HEARTS TABLE DECORATION,2,10/23/2011 15:29,0.83,14432,United Kingdom
572309,72232,FENG SHUI PILLAR CANDLE,12,10/23/2011 15:29,0.19,14432,United Kingdom
572309,22488,NATURAL SLATE RECTANGLE CHALKBOARD,4,10/23/2011 15:29,1.65,14432,United Kingdom
572311,23147,SINGLE ANTIQUE ROSE HOOK IVORY,6,10/23/2011 15:45,1.45,14035,United Kingdom
572312,23075,PARLOUR CERAMIC WALL HOOK,2,10/23/2011 15:47,4.15,15022,United Kingdom
572312,22704,WRAP RED APPLES ,25,10/23/2011 15:47,0.42,15022,United Kingdom
572314,23202,JUMBO BAG VINTAGE LEAF,2,10/23/2011 15:59,2.08,17111,United Kingdom
572317,23353,6 GIFT TAGS VINTAGE CHRISTMAS ,1,10/23/2011 16:13,0.83,14629,United Kingdom
572317,23556,LANDMARK FRAME COVENT GARDEN ,1,10/23/2011 16:13,12.5,14629,United Kingdom
572317,22737,RIBBON REEL CHRISTMAS PRESENT ,1,10/23/2011 16:13,1.65,14629,United Kingdom
572317,21992,VINTAGE PAISLEY STATIONERY SET,2,10/23/2011 16:13,1.25,14629,United Kingdom
572318,21166,COOK WITH WINE METAL SIGN ,1,10/23/2011 16:19,2.08,15436,United Kingdom
572318,22722,SET OF 6 SPICE TINS PANTRY DESIGN,2,10/23/2011 16:19,3.95,15436,United Kingdom
572319,22155,STAR DECORATION RUSTIC,5,10/23/2011 16:19,0.42,14704,United Kingdom
572320,84879,ASSORTED COLOUR BIRD ORNAMENT,8,10/24/2011 8:48,1.69,16325,United Kingdom
572321,22138,BAKING SET 9 PIECE RETROSPOT ,3,10/24/2011 8:59,4.95,15592,United Kingdom
572327,84077,WORLD WAR 2 GLIDERS ASSTD DESIGNS,48,10/24/2011 10:08,0.29,15277,United Kingdom
572335,22739,RIBBON REEL CHRISTMAS SOCK BAUBLE,10,10/24/2011 10:27,1.65,14493,United Kingdom
572335,21791,VINTAGE HEADS AND TAILS CARD GAME ,12,10/24/2011 10:27,1.25,14493,United Kingdom
572336,22909,SET OF 20 VINTAGE CHRISTMAS NAPKINS,24,10/24/2011 10:29,0.85,13523,United Kingdom
572353,84030E,ENGLISH ROSE HOT WATER BOTTLE,4,10/24/2011 11:40,4.25,15215,United Kingdom
572380,23351,ROLL WRAP 50'S CHRISTMAS,12,10/24/2011 11:51,1.25,16019,United Kingdom
572399,85123A,WHITE HANGING HEART T-LIGHT HOLDER,6,10/24/2011 11:56,2.95,15628,United Kingdom
572447,22558,CLOTHES PEGS RETROSPOT PACK 24 ,1,10/24/2011 12:25,1.65,17811,United Kingdom
572447,84991,60 TEATIME FAIRY CAKE CASES,1,10/24/2011 12:25,0.55,17811,United Kingdom
572451,84879,ASSORTED COLOUR BIRD ORNAMENT,24,10/24/2011 12:36,1.69,12921,United Kingdom
572457,71270,PHOTO CLIP LINE,24,10/24/2011 12:44,1.25,12594,Italy
572458,21181,PLEASE ONE PERSON METAL SIGN,24,10/24/2011 12:51,2.1,15142,United Kingdom
572460,22727,ALARM CLOCK BAKELIKE RED ,4,10/24/2011 12:54,3.75,17001,United Kingdom
572464,22999,TRAVEL CARD WALLET VINTAGE LEAF,1,10/24/2011 13:08,0.42,17081,United Kingdom
572464,23535,WALL ART BICYCLE SAFETY,1,10/24/2011 13:08,5.95,17081,United Kingdom
572464,23194,GYMKHANA TREASURE BOOK BOX,1,10/24/2011 13:08,2.25,17081,United Kingdom
572475,85199S,SMALL HANGING IVORY/RED WOOD BIRD,3,10/24/2011 13:37,0.42,15271,United Kingdom
572475,22554,PLASTERS IN TIN WOODLAND ANIMALS,3,10/24/2011 13:37,1.65,15271,United Kingdom
572483,20848,ZINC HEART LATTICE CHARGER SMALL,1,10/24/2011 13:50,2.95,16444,United Kingdom
572484,23307,SET OF 60 PANTRY DESIGN CAKE CASES ,3,10/24/2011 13:50,0.55,17220,United Kingdom
572487,20724,RED RETROSPOT CHARLOTTE BAG,10,10/24/2011 13:52,0.85,15801,United Kingdom
572499,23272,TREE T-LIGHT HOLDER WILLIE WINKIE,12,10/24/2011 14:10,1.65,15786,United Kingdom
572499,23266,SET OF 3 WOODEN STOCKING DECORATION,12,10/24/2011 14:10,1.25,15786,United Kingdom
572499,22735,RIBBON REEL SOCKS AND MITTENS,10,10/24/2011 14:10,1.65,15786,United Kingdom
572499,22086,PAPER CHAIN KIT 50'S CHRISTMAS ,6,10/24/2011 14:10,2.95,15786,United Kingdom
572499,23426,METAL SIGN DROP YOUR PANTS,6,10/24/2011 14:10,2.89,15786,United Kingdom
572509,23555,LANDMARK FRAME NOTTING HILL ,1,10/24/2011 14:25,12.5,17004,United Kingdom
572511,22572,ROCKING HORSE GREEN CHRISTMAS ,12,10/24/2011 14:29,0.85,14895,United Kingdom
572511,23536,VILLAGE SHOW WALL ART,4,10/24/2011 14:29,5.95,14895,United Kingdom
572513,21618,4 WILDFLOWER BOTANICAL CANDLES,1,10/24/2011 14:36,1.25,16728,United Kingdom
572513,21259,VICTORIAN SEWING BOX SMALL ,1,10/24/2011 14:36,5.95,16728,United Kingdom
572513,21790,VINTAGE SNAP CARDS,4,10/24/2011 14:36,0.85,16728,United Kingdom
