InvoiceNo,StockCode,Description,Quantity,InvoiceDate,UnitPrice,CustomerID,Country
536367,22622,BOX OF VINTAGE ALPHABET BLOCKS,2,12/1/2010 8:34,9.95,13047,United Kingdom
536373,22752,SET 7 BABUSHKA NESTING BOXES,2,12/1/2010 9:02,7.65,17850,United Kingdom
536381,22774,RED DRAWER KNOB ACRYLIC EDWARDIAN,24,12/1/2010 9:41,1.25,15311,United Kingdom
536390,21485,RETROSPOT HEART HOT WATER BOTTLE,24,12/1/2010 10:19,4.25,17511,United Kingdom
536390,22961,JAM MAKING SET PRINTED,12,12/1/2010 10:19,1.45,17511,United Kingdom
536390,21080,SET/20 RED RETROSPOT PAPER NAPKINS ,96,12/1/2010 10:19,0.64,17511,United Kingdom
536396,82483,WOOD 2 DRAWER CABINET WHITE FINISH,2,12/1/2010 10:51,4.95,17850,United Kingdom
536404,84380,SET OF 3 BUTTERFLY COOKIE CUTTERS,12,12/1/2010 11:29,1.25,16218,United Kingdom
536406,21730,GLASS STAR FROSTED T-LIGHT HOLDER,6,12/1/2010 11:33,4.25,17850,United Kingdom
536408,84949,SILVER HANGING T-LIGHT HOLDER,6,12/1/2010 11:41,1.65,14307,United Kingdom
536412,20750,RED RETROSPOT MINI CASES,1,12/1/2010 11:49,7.95,17920,United Kingdom
536415,22750,FELTCRAFT PRINCESS LOLA DOLL,2,12/1/2010 11:57,3.75,12838,United Kingdom
536415,22738,RIBBON REEL SNOWY VILLAGE,3,12/1/2010 11:57,1.65,12838,United Kingdom
536415,22775,PURPLE DRAWERKNOB ACRYLIC EDWARDIAN,1,12/1/2010 11:57,1.25,12838,United Kingdom
536420,21715,GIRLS VINTAGE TIN SEASIDE BUCKET,8,12/1/2010 12:03,2.55,16583,United Kingdom
536423,21481,FAWN BLUE HOT WATER BOTTLE,6,12/1/2010 12:08,2.95,18085,United Kingdom
536446,21890,S/6 WOODEN SKITTLES IN COTTON BAG,2,12/1/2010 12:15,2.95,15983,United Kingdom
536464,21738,COSY SLIPPER SHOES SMALL  RED ,1,12/1/2010 12:23,2.95,17968,United Kingdom
536464,16258A,SWIRLY CIRCULAR RUBBERS IN BAG,1,12/1/2010 12:23,0.42,17968,United Kingdom
536488,22713,CARD I LOVE LONDON ,12,12/1/2010 12:31,0.42,17897,United Kingdom
536520,20754,RETROSPOT RED WASHING UP GLOVES,1,12/1/2010 12:43,2.1,14729,United Kingdom
536520,22107,PIZZA PLATE IN BOX,2,12/1/2010 12:43,3.75,14729,United Kingdom
536520,84596E,SMALL LICORICE DES PINK BOWL,1,12/1/2010 12:43,1.25,14729,United Kingdom
536522,85035B,CHOCOLATE 3 WICK MORRIS BOX CANDLE,1,12/1/2010 12:49,4.25,15012,United Kingdom
536524,22697,GREEN REGENCY TEACUP AND SAUCER,6,12/1/2010 12:51,2.95,17572,United Kingdom
536528,21731,RED TOADSTOOL LED NIGHT LIGHT,2,12/1/2010 13:17,1.65,15525,United Kingdom
536531,15056BL,EDWARDIAN PARASOL BLACK,12,12/1/2010 13:23,5.95,15485,United Kingdom
536532,22842,BISCUIT TIN VINTAGE RED,6,12/1/2010 13:24,6.75,12433,Norway
536532,22543,MINI JIGSAW BAKE A CAKE ,24,12/1/2010 13:24,0.42,12433,Norway
536537,20867,PINK ROSE FABRIC MIRROR,36,12/1/2010 13:51,1.25,15922,United Kingdom
536538,22173,METAL 4 HOOK HANGER FRENCH CHATEAU,2,12/1/2010 13:54,2.95,14594,United Kingdom
536540,22968,ROSE COTTAGE KEEPSAKE BOX ,4,12/1/2010 14:05,9.95,14911,EIRE
536551,22900, SET 2 TEA TOWELS I LOVE LONDON ,1,12/1/2010 14:34,2.95,17346,United Kingdom
536557,21486,PINK HEART DOTS HOT WATER BOTTLE,2,12/1/2010 14:41,3.75,17841,United Kingdom
536557,22794,SWEETHEART WIRE MAGAZINE RACK,1,12/1/2010 14:41,7.95,17841,United Kingdom
536560,48111,DOORMAT 3 SMILEY CATS,10,12/1/2010 15:00,6.75,13093,United Kingdom
536560,22652,TRAVEL SEWING KIT,10,12/1/2010 15:00,1.65,13093,United Kingdom
536562,22187,GREEN CHRISTMAS TREE CARD HOLDER,4,12/1/2010 15:08,4.25,13468,United Kingdom
536569,22738,RIBBON REEL SNOWY VILLAGE,1,12/1/2010 15:35,1.65,16274,United Kingdom
536569,22816,CARD MOTORBIKE SANTA,12,12/1/2010 15:35,0.42,16274,United Kingdom
536587,21232,STRAWBERRY CERAMIC TRINKET BOX,12,12/1/2010 16:33,1.25,14142,United Kingdom
536587,21098,CHRISTMAS TOILET ROLL,12,12/1/2010 16:33,1.25,14142,United Kingdom
536605,20966,SANDWICH BATH SPONGE,10,12/2/2010 8:52,1.25,13715,United Kingdom
536605,22274,FELTCRAFT DOLL EMILY,6,12/2/2010 8:52,2.95,13715,United Kingdom
536609,85123A,WHITE HANGING HEART T-LIGHT HOLDER,6,12/2/2010 9:41,2.55,17850,United Kingdom
536610,22633,HAND WARMER UNION JACK,6,12/2/2010 9:42,1.85,17850,United Kingdom
536612,84029G,KNITTED UNION FLAG HOT WATER BOTTLE,6,12/2/2010 9:44,3.39,17850,United Kingdom
536613,22029,SPACEBOY BIRTHDAY CARD,12,12/2/2010 9:44,0.42,17855,United Kingdom
536615,84077,WORLD WAR 2 GLIDERS ASSTD DESIGNS,48,12/2/2010 10:09,0.29,14047,United Kingdom
536620,22965,3 TRADITIONAl BISCUIT CUTTERS  SET,6,12/2/2010 10:27,2.1,14135,United Kingdom
536620,21061,PARTY INVITES FOOTBALL,12,12/2/2010 10:27,0.85,14135,United Kingdom
536623,22028,PENNY FARTHING BIRTHDAY CARD,12,12/2/2010 10:39,0.42,15601,United Kingdom
536628,21871,SAVE THE PLANET MUG,6,12/2/2010 10:54,1.06,17850,United Kingdom
536635,22112,CHOCOLATE HOT WATER BOTTLE,12,12/2/2010 11:22,4.95,15955,United Kingdom
536637,22916,HERB MARKER THYME,2,12/2/2010 11:35,0.65,18041,United Kingdom
536637,22197,SMALL POPCORN HOLDER,1,12/2/2010 11:35,0.85,18041,United Kingdom
536643,20970,PINK FLORAL FELTCRAFT SHOULDER BAG,1,12/2/2010 11:57,3.75,14390,United Kingdom
536674,22964,3 PIECE SPACEBOY COOKIE CUTTER SET,1,12/2/2010 12:16,2.1,15923,United Kingdom
536676,84846A,SCENTED CANDLE IN DIGITALIS TIN,6,12/2/2010 12:18,2.1,16752,United Kingdom
536681,21588,RETROSPOT GIANT TUBE MATCHES,3,12/2/2010 12:22,2.55,17287,United Kingdom
536685,82486,WOOD S/3 CABINET ANT WHITE FINISH,4,12/2/2010 12:23,6.95,17850,United Kingdom
536735,22659,LUNCH BOX I LOVE LONDON,128,12/2/2010 12:58,1.65,17381,United Kingdom
536739,35004C,SET OF 3 COLOURED  FLYING DUCKS,3,12/2/2010 13:08,5.45,14180,United Kingdom
536740,22964,3 PIECE SPACEBOY COOKIE CUTTER SET,6,12/2/2010 13:08,2.1,15827,United Kingdom
536741,84879,ASSORTED COLOUR BIRD ORNAMENT,8,12/2/2010 13:11,1.69,13117,United Kingdom
536742,22196,SMALL HEART MEASURING SPOONS,1,12/2/2010 13:14,0.85,16916,United Kingdom
536742,21213,PACK OF 72 SKULL CAKE CASES,1,12/2/2010 13:14,0.55,16916,United Kingdom
536746,22604,SET OF 4 NAPKIN CHARMS CUTLERY,6,12/2/2010 13:39,2.55,16510,United Kingdom
536746,21259,VICTORIAN SEWING BOX SMALL ,2,12/2/2010 13:39,5.95,16510,United Kingdom
536747,85049A,TRADITIONAL CHRISTMAS RIBBONS,3,12/2/2010 13:44,1.25,17802,United Kingdom
536748,22634,CHILDS BREAKFAST SET SPACEBOY ,2,12/2/2010 13:45,9.95,15107,United Kingdom
536749,22371,AIRLINE BAG VINTAGE TOKYO 78,1,12/2/2010 13:49,4.25,17976,United Kingdom
536750,82486,WOOD S/3 CABINET ANT WHITE FINISH,4,12/2/2010 14:04,6.95,17850,United Kingdom
536752,84029E,RED WOOLLY HOTTIE WHITE HEART.,6,12/2/2010 14:06,3.39,17850,United Kingdom
536762,22969,HOMEMADE JAM SCENTED CANDLES,12,12/2/2010 14:40,1.45,16186,United Kingdom
536769,21212,PACK OF 72 RETROSPOT CAKE CASES,24,12/2/2010 14:47,0.55,17581,United Kingdom
536769,20724,RED RETROSPOT CHARLOTTE BAG,10,12/2/2010 14:47,0.85,17581,United Kingdom
536783,71459,HANGING JAM JAR T-LIGHT HOLDER,144,12/2/2010 15:19,0.72,15061,United Kingdom
536783,16237,SLEEPING CAT ERASERS,270,12/2/2010 15:19,0.16,15061,United Kingdom
536795,22866,HAND WARMER SCOTTY DOG DESIGN,24,12/2/2010 15:40,2.1,15640,United Kingdom
536796,22376,AIRLINE BAG VINTAGE JET SET WHITE,1,12/2/2010 15:46,4.25,15574,United Kingdom
536796,21587,COSY HOUR GIANT TUBE MATCHES,1,12/2/2010 15:46,2.55,15574,United Kingdom
536796,22748,POPPY'S PLAYHOUSE KITCHEN,1,12/2/2010 15:46,2.1,15574,United Kingdom
536804,22697,GREEN REGENCY TEACUP AND SAUCER,6,12/2/2010 16:34,2.95,14031,United Kingdom
536821,21217,RED RETROSPOT ROUND CAKE TINS,1,12/2/2010 17:17,9.95,17757,United Kingdom
536833,22187,GREEN CHRISTMAS TREE CARD HOLDER,4,12/2/2010 17:48,4.25,18239,United Kingdom
536833,35961,FOLKART ZINC HEART CHRISTMAS DEC,12,12/2/2010 17:48,0.85,18239,United Kingdom
536841,22775,PURPLE DRAWERKNOB ACRYLIC EDWARDIAN,12,12/2/2010 18:27,1.25,16150,United Kingdom
536845,21479,WHITE SKULL HOT WATER BOTTLE ,1,12/2/2010 19:18,3.75,17961,United Kingdom
536845,22635,CHILDS BREAKFAST SET DOLLY GIRL ,1,12/2/2010 19:18,9.95,17961,United Kingdom
536846,22646,CERAMIC STRAWBERRY CAKE MONEY BANK,1,12/2/2010 19:59,1.45,14573,United Kingdom
536846,22113,GREY HEART HOT WATER BOTTLE,1,12/2/2010 19:59,3.75,14573,United Kingdom
536851,21429,RED GINGHAM ROSE JEWELLERY BOX,56,12/3/2010 9:49,1.65,12967,United Kingdom
536852,22549,PICTURE DOMINOES,12,12/3/2010 9:51,1.45,12686,France
536852,21791,VINTAGE HEADS AND TAILS CARD GAME ,12,12/3/2010 9:51,1.25,12686,France
536856,21990,MODERN FLORAL STATIONERY SET,6,12/3/2010 10:26,2.95,13370,United Kingdom
536857,85049E,SCANDINAVIAN REDS RIBBONS,3,12/3/2010 10:33,1.25,16883,United Kingdom
536859,85123A,WHITE HANGING HEART T-LIGHT HOLDER,2,12/3/2010 10:43,2.95,12841,United Kingdom
536859,21878,PACK OF 6 SANDCASTLE FLAGS ASSORTED,3,12/3/2010 10:43,0.85,12841,United Kingdom
536938,22356,CHARLOTTE BAG PINK POLKADOT,20,12/3/2010 12:05,0.85,14680,United Kingdom
536943,22585,PACK OF 6 BIRDY GIFT TAGS,5,12/3/2010 12:11,1.25,17884,United Kingdom
536943,22738,RIBBON REEL SNOWY VILLAGE,1,12/3/2010 12:11,1.65,17884,United Kingdom
536943,35957,SMALLFOLKART BAUBLE CHRISTMAS DEC,48,12/3/2010 12:11,0.42,17884,United Kingdom
536945,21469,POLKA DOT RAFFIA FOOD COVER,1,12/3/2010 12:24,3.75,14083,United Kingdom
536946,22451,SILK PURSE BABUSHKA RED,12,12/3/2010 12:28,3.35,13013,United Kingdom
536947,20983,12 PENCILS TALL TUBE RED RETROSPOT,12,12/3/2010 12:29,0.85,13013,United Kingdom
536974,21700,BIG DOUGHNUT FRIDGE MAGNETS,12,12/3/2010 13:59,0.85,12682,France
536976,21982,PACK OF 12 SUKI TISSUES ,3,12/3/2010 14:18,0.29,14723,United Kingdom
536984,22041,"RECORD FRAME 7"" SINGLE SIZE ",6,12/3/2010 14:35,2.55,17841,United Kingdom
536986,22909,SET OF 20 VINTAGE CHRISTMAS NAPKINS,24,12/3/2010 14:40,0.85,16140,United Kingdom
536987,20854,BLUE PATCH PURSE PINK HEART,1,12/3/2010 14:54,1.65,17198,United Kingdom
536993,22867,HAND WARMER BIRD DESIGN,1,12/3/2010 15:19,2.1,14396,United Kingdom
537022,85035A,GARDENIA 3 WICK MORRIS BOXED CANDLE,4,12/3/2010 15:45,4.25,12725,Italy
537034,20971,PINK BLUE FELT CRAFT TRINKET BOX,12,12/3/2010 17:20,1.25,13081,United Kingdom
537036,82551,LAUNDRY 15C METAL SIGN,1,12/3/2010 17:28,1.45,15545,United Kingdom
537042,22423,REGENCY CAKESTAND 3 TIER,1,12/5/2010 10:45,12.75,13838,United Kingdom
537045,72802A,ROSE SCENT CANDLE IN JEWELLED BOX,1,12/5/2010 10:54,4.25,15038,United Kingdom
537047,22130,PARTY CONE CHRISTMAS DECORATION ,6,12/5/2010 11:02,0.85,13069,United Kingdom
537050,21452,TOADSTOOL MONEY BOX,2,12/5/2010 11:10,2.95,14800,United Kingdom
537051,20936,FORKED CACTUS CANDLE,6,12/5/2010 11:12,2.95,15708,United Kingdom
537054,22301,COFFEE MUG CAT + BIRD DESIGN,3,12/5/2010 11:40,2.55,16931,United Kingdom
537055,22415,WHITE TISSUE REAM,1,12/5/2010 11:45,7.95,16814,United Kingdom
537059,22834,HAND WARMER BABUSHKA DESIGN,4,12/5/2010 11:54,2.1,14813,United Kingdom
537065,21774,DECORATIVE CATS BATHROOM BOTTLE,12,12/5/2010 11:57,1.25,12567,France
537065,21533,RETROSPOT LARGE MILK JUG,3,12/5/2010 11:57,4.95,12567,France
537065,84997B,RED 3 PIECE RETROSPOT CUTLERY SET,6,12/5/2010 11:57,3.75,12567,France
537065,21982,PACK OF 12 SUKI TISSUES ,24,12/5/2010 11:57,0.29,12567,France
537081,20681,PINK POLKADOT CHILDRENS UMBRELLA,6,12/5/2010 12:00,3.25,15332,Lithuania
537111,22634,CHILDS BREAKFAST SET SPACEBOY ,1,12/5/2010 12:08,9.95,14810,United Kingdom
537126,22274,FELTCRAFT DOLL EMILY,1,12/5/2010 12:13,2.95,18118,United Kingdom
537126,22331,WOODLAND PARTY BAG + STICKER SET,1,12/5/2010 12:13,1.65,18118,United Kingdom
537126,21479,WHITE SKULL HOT WATER BOTTLE ,1,12/5/2010 12:13,3.75,18118,United Kingdom
537131,85049A,TRADITIONAL CHRISTMAS RIBBONS,6,12/5/2010 12:26,1.25,15716,United Kingdom
537133,21034,REX CASH+CARRY JUMBO SHOPPER,3,12/5/2010 12:29,0.95,18156,United Kingdom
537133,47559B,TEA TIME OVEN GLOVE,1,12/5/2010 12:29,1.25,18156,United Kingdom
537133,22558,CLOTHES PEGS RETROSPOT PACK 24 ,2,12/5/2010 12:29,1.49,18156,United Kingdom
537134,21034,REX CASH+CARRY JUMBO SHOPPER,1,12/5/2010 12:34,0.95,16983,United Kingdom
537135,20974,12 PENCILS SMALL TUBE SKULL,6,12/5/2010 12:35,0.65,17059,United Kingdom
537135,21034,REX CASH+CARRY JUMBO SHOPPER,2,12/5/2010 12:35,0.95,17059,United Kingdom
537135,22110,BIRD HOUSE HOT WATER BOTTLE,2,12/5/2010 12:35,2.55,17059,United Kingdom
537135,22810,SET OF 6 T-LIGHTS SNOWMEN,6,12/5/2010 12:35,2.95,17059,United Kingdom
537137,85185B,PINK HORSE SOCK PUPPET,1,12/5/2010 12:43,2.95,16327,United Kingdom
537137,21421,PORCELAIN ROSE LARGE ,3,12/5/2010 12:43,1.25,16327,United Kingdom
537140,22632,HAND WARMER RED RETROSPOT,1,12/5/2010 12:53,2.1,12748,United Kingdom
537140,22669,RED BABY BUNTING ,2,12/5/2010 12:53,2.95,12748,United Kingdom
537144,22553,PLASTERS IN TIN SKULLS,1,12/5/2010 13:00,1.65,15880,United Kingdom
537144,35953,FOLKART STAR CHRISTMAS DECORATIONS,24,12/5/2010 13:00,1.25,15880,United Kingdom
537144,21881,CUTE CATS TAPE,1,12/5/2010 13:00,0.65,15880,United Kingdom
537144,22190,LOCAL CAFE MUG,1,12/5/2010 13:00,2.1,15880,United Kingdom
537153,21696,SMALL SILVER TRELLIS CANDLEPOT,6,12/5/2010 13:03,2.95,16718,United Kingdom
537153,22972,CHILDREN'S SPACEBOY MUG,6,12/5/2010 13:03,1.65,16718,United Kingdom
537154,84029G,KNITTED UNION FLAG HOT WATER BOTTLE,6,12/5/2010 13:05,3.75,15808,United Kingdom
537154,22745,POPPY'S PLAYHOUSE BEDROOM ,1,12/5/2010 13:05,2.1,15808,United Kingdom
537156,82581,TOILET METAL SIGN,2,12/5/2010 13:08,0.55,17858,United Kingdom
537160,22694,WICKER STAR ,3,12/5/2010 13:18,2.1,14161,United Kingdom
537163,22712,CARD DOLLY GIRL ,12,12/5/2010 13:21,0.42,17863,United Kingdom
537179,22729,ALARM CLOCK BAKELIKE ORANGE,12,12/5/2010 13:29,3.75,13767,United Kingdom
537192,22667,RECIPE BOX RETROSPOT ,1,12/5/2010 13:42,2.95,16402,United Kingdom
537193,22457,NATURAL SLATE HEART CHALKBOARD ,12,12/5/2010 13:49,2.95,15023,United Kingdom
537193,22862,LOVE HEART NAPKIN BOX ,4,12/5/2010 13:49,4.25,15023,United Kingdom
537194,22619,SET OF 6 SOLDIER SKITTLES,80,12/5/2010 13:53,3.39,17402,United Kingdom
537195,21504,SKULLS GREETING CARD,12,12/5/2010 13:55,0.42,15311,United Kingdom
537196,22151,PLACE SETTING WHITE HEART,1,12/5/2010 13:55,0.42,15426,United Kingdom
537196,22851,SET 20 NAPKINS FAIRY CAKES DESIGN ,1,12/5/2010 13:55,0.85,15426,United Kingdom
537196,21340,CLASSIC METAL BIRDCAGE PLANT HOLDER,1,12/5/2010 13:55,12.75,15426,United Kingdom
537199,22866,HAND WARMER SCOTTY DOG DESIGN,1,12/5/2010 14:06,2.1,15894,United Kingdom
537199,22443,GROW YOUR OWN HERBS SET OF 3,1,12/5/2010 14:06,7.95,15894,United Kingdom
537200,22110,BIRD HOUSE HOT WATER BOTTLE,1,12/5/2010 14:17,2.55,15867,United Kingdom
537200,21038,SET/4 MODERN VINTAGE COTTON NAPKINS,3,12/5/2010 14:17,2.95,15867,United Kingdom
537201,22337,ANGEL DECORATION PAINTED ZINC ,24,12/5/2010 14:19,0.65,12472,Germany
537201,20668,DISCO BALL CHRISTMAS DECORATION,24,12/5/2010 14:19,0.12,12472,Germany
537201,22321,BIRD DECORATION RED RETROSPOT,12,12/5/2010 14:19,0.85,12472,Germany
537201,22962,JAM JAR WITH PINK LID,24,12/5/2010 14:19,0.85,12472,Germany
537201,22972,CHILDREN'S SPACEBOY MUG,12,12/5/2010 14:19,1.65,12472,Germany
537201,22818,CARD CHRISTMAS VILLAGE,24,12/5/2010 14:19,0.42,12472,Germany
537202,22130,PARTY CONE CHRISTMAS DECORATION ,6,12/5/2010 14:25,0.85,14506,United Kingdom
537202,22274,FELTCRAFT DOLL EMILY,1,12/5/2010 14:25,2.95,14506,United Kingdom
537202,22149,FELTCRAFT 6 FLOWER FRIENDS,2,12/5/2010 14:25,2.1,14506,United Kingdom
537204,22577,WOODEN HEART CHRISTMAS SCANDINAVIAN,5,12/5/2010 14:45,0.85,15555,United Kingdom
537204,22603,CHRISTMAS RETROSPOT TREE WOOD,5,12/5/2010 14:45,0.85,15555,United Kingdom
537206,21485,RETROSPOT HEART HOT WATER BOTTLE,3,12/5/2010 15:02,4.95,15235,United Kingdom
537208,22666,RECIPE BOX PANTRY YELLOW DESIGN,1,12/5/2010 15:12,2.95,15889,United Kingdom
537208,21401,BLUE PUDDING SPOON,1,12/5/2010 15:12,0.42,15889,United Kingdom
537210,20726,LUNCH BAG WOODLAND,1,12/5/2010 15:15,1.65,15953,United Kingdom
537211,20725,LUNCH BAG RED RETROSPOT,10,12/5/2010 15:18,1.65,16143,United Kingdom
537212,85099B,JUMBO BAG RED RETROSPOT,10,12/5/2010 15:21,1.95,12720,Germany
537212,22344,PARTY PIZZA DISH PINK POLKADOT,12,12/5/2010 15:21,0.85,12720,Germany
537219,21901,"KEY FOB , BACK DOOR ",1,12/5/2010 15:47,0.65,14081,United Kingdom
537219,22618,COOKING SET RETROSPOT,1,12/5/2010 15:47,9.95,14081,United Kingdom
537219,22834,HAND WARMER BABUSHKA DESIGN,2,12/5/2010 15:47,2.1,14081,United Kingdom
537224,82551,LAUNDRY 15C METAL SIGN,3,12/5/2010 16:24,1.45,13174,United Kingdom
537224,21901,"KEY FOB , BACK DOOR ",1,12/5/2010 16:24,0.65,13174,United Kingdom
537224,22294,HEART FILIGREE DOVE  SMALL,7,12/5/2010 16:24,1.25,13174,United Kingdom
537225,22625,RED KITCHEN SCALES,1,12/5/2010 16:41,8.5,12748,United Kingdom
537228,22144,CHRISTMAS CRAFT LITTLE FRIENDS,12,12/6/2010 8:43,2.1,17677,United Kingdom
537246,20728,LUNCH BAG CARS BLUE,10,12/6/2010 10:27,1.65,12808,Portugal
537254,22570,FELTCRAFT CUSHION RABBIT,3,12/6/2010 11:01,3.75,15898,United Kingdom
537254,20765,CHRYSANTHEMUM SKETCHBOOK ,1,12/6/2010 11:01,3.75,15898,United Kingdom
537255,22469,HEART OF WICKER SMALL,12,12/6/2010 11:03,1.65,14443,United Kingdom
537334,22176,BLUE OWL SOFT TOY,4,12/6/2010 12:06,2.95,16719,United Kingdom
537346,22818,CARD CHRISTMAS VILLAGE,12,12/6/2010 12:21,0.42,15301,United Kingdom
537354,22348,TEA BAG PLATE RED RETROSPOT,1,12/6/2010 12:23,0.85,12748,United Kingdom
537362,72351B,SET/6 PINK  BUTTERFLY T-LIGHTS,1,12/6/2010 12:34,2.1,17596,United Kingdom
537369,22719,GUMBALL MONOCHROME COAT RACK,1,12/6/2010 12:41,1.25,17860,United Kingdom
537369,84795B,SUNSET CHECK HAMMOCK,4,12/6/2010 12:41,7.95,17860,United Kingdom
537370,22866,HAND WARMER SCOTTY DOG DESIGN,1,12/6/2010 12:44,2.1,13155,United Kingdom
537371,22091,EMPIRE TISSUE BOX,4,12/6/2010 12:47,1.25,15028,United Kingdom
537374,22865,HAND WARMER OWL DESIGN,1,12/6/2010 12:55,2.1,17259,United Kingdom
537375,22964,3 PIECE SPACEBOY COOKIE CUTTER SET,2,12/6/2010 12:55,2.1,17019,United Kingdom
537375,22551,PLASTERS IN TIN SPACEBOY,6,12/6/2010 12:55,1.65,17019,United Kingdom
537375,21986,PACK OF 12 PINK POLKADOT TISSUES,5,12/6/2010 12:55,0.29,17019,United Kingdom
537376,20969,RED FLORAL FELTCRAFT SHOULDER BAG,4,12/6/2010 12:59,3.75,16722,United Kingdom
537377,22531,MAGIC DRAWING SLATE CIRCUS PARADE  ,1,12/6/2010 13:01,0.42,15882,United Kingdom
537378,22336,DOVE DECORATION PAINTED ZINC ,24,12/6/2010 13:06,0.65,14911,EIRE
537385,22909,SET OF 20 VINTAGE CHRISTMAS NAPKINS,2,12/6/2010 13:22,0.85,14487,United Kingdom
537389,22632,HAND WARMER RED RETROSPOT,5,12/6/2010 13:41,2.1,17757,United Kingdom
537390,40005B,BLUE ORGANDY ROUND LAMPSHADE W BEA,1,12/6/2010 13:47,0.85,16658,United Kingdom
537391,22185,SLATE TILE NATURAL HANGING,5,12/6/2010 13:53,1.65,16550,United Kingdom
537392,21481,FAWN BLUE HOT WATER BOTTLE,4,12/6/2010 13:58,2.95,17068,United Kingdom
537395,20982,12 PENCILS TALL TUBE SKULLS,3,12/6/2010 14:05,0.85,15356,United Kingdom
537395,21558,SKULL LUNCH BOX WITH CUTLERY ,1,12/6/2010 14:05,2.55,15356,United Kingdom
537395,20983,12 PENCILS TALL TUBE RED RETROSPOT,1,12/6/2010 14:05,0.85,15356,United Kingdom
537399,20669,RED HEART LUGGAGE TAG,2,12/6/2010 14:31,1.25,13030,United Kingdom
537399,22845,VINTAGE CREAM CAT FOOD CONTAINER,1,12/6/2010 14:31,6.35,13030,United Kingdom
537400,21181,PLEASE ONE PERSON METAL SIGN,1,12/6/2010 14:36,2.1,17191,United Kingdom
537400,21390,FILIGRIS HEART WITH BUTTERFLY,6,12/6/2010 14:36,1.25,17191,United Kingdom
537400,82551,LAUNDRY 15C METAL SIGN,1,12/6/2010 14:36,1.45,17191,United Kingdom
537400,22093,MOTORING TISSUE BOX,6,12/6/2010 14:36,1.25,17191,United Kingdom
537400,35961,FOLKART ZINC HEART CHRISTMAS DEC,2,12/6/2010 14:36,0.85,17191,United Kingdom
537409,21262,WHITE GOOSE FEATHER CHRISTMAS TREE ,6,12/6/2010 15:00,2.95,15194,United Kingdom
537415,22840,ROUND CAKE TIN VINTAGE RED,4,12/6/2010 15:09,7.95,16654,United Kingdom
537418,22941,CHRISTMAS LIGHTS 10 REINDEER,1,12/6/2010 15:13,8.5,17884,United Kingdom
537418,21580,RABBIT  DESIGN  COTTON TOTE BAG,1,12/6/2010 15:13,2.25,17884,United Kingdom
537419,85227,SET OF 6 3D KIT CARDS FOR KIDS,12,12/6/2010 15:14,0.85,13495,United Kingdom
537420,22333,RETROSPOT PARTY BAG + STICKER SET,8,12/6/2010 15:18,1.65,17519,United Kingdom
537420,22822,CREAM WALL PLANTER HEART SHAPED,2,12/6/2010 15:18,5.95,17519,United Kingdom
537421,22585,PACK OF 6 BIRDY GIFT TAGS,1,12/6/2010 15:25,1.25,17218,United Kingdom
537428,22561,WOODEN SCHOOL COLOURING SET,8,12/6/2010 15:38,1.65,17320,United Kingdom
537433,22086,PAPER CHAIN KIT 50'S CHRISTMAS ,80,12/6/2010 16:36,2.55,12913,United Kingdom
537464,22751,FELTCRAFT PRINCESS OLIVIA DOLL,4,12/7/2010 10:14,3.75,14907,United Kingdom
537467,22114,HOT WATER BOTTLE TEA AND SYMPATHY,4,12/7/2010 10:36,3.95,16059,United Kingdom
537472,22595,CHRISTMAS GINGHAM HEART,12,12/7/2010 11:11,0.85,12971,United Kingdom
537484,84970S,HANGING HEART ZINC T-LIGHT HOLDER,24,12/7/2010 11:30,0.85,14733,United Kingdom
537595,82483,WOOD 2 DRAWER CABINET WHITE FINISH,2,12/7/2010 12:29,5.95,13569,United Kingdom
537606,22637,PIGGY BANK RETROSPOT ,4,12/7/2010 13:16,2.55,15002,United Kingdom
537608,48185,DOORMAT FAIRY CAKE,1,12/7/2010 13:20,7.95,15024,United Kingdom
537612,22112,CHOCOLATE HOT WATER BOTTLE,6,12/7/2010 13:28,4.95,13769,United Kingdom
537614,22725,ALARM CLOCK BAKELIKE CHOCOLATE,2,12/7/2010 13:29,3.75,16904,United Kingdom
537623,22798,ANTIQUE GLASS DRESSING TABLE POT,4,12/7/2010 14:31,2.95,15858,United Kingdom
537624,22553,PLASTERS IN TIN SKULLS,1,12/7/2010 14:41,1.65,12748,United Kingdom
537624,22903,CALENDAR FAMILY FAVOURITES,1,12/7/2010 14:41,2.95,12748,United Kingdom
537624,21826,EIGHT PIECE DINOSAUR SET,3,12/7/2010 14:41,1.25,12748,United Kingdom
537624,22737,RIBBON REEL CHRISTMAS PRESENT ,5,12/7/2010 14:41,1.65,12748,United Kingdom
537626,20782,CAMOUFLAGE EAR MUFF HEADPHONES,6,12/7/2010 14:57,5.49,12347,Iceland
537626,22212,FOUR HOOK  WHITE LOVEBIRDS,6,12/7/2010 14:57,2.1,12347,Iceland
537629,22189,CREAM HEART CARD HOLDER,8,12/7/2010 15:03,3.95,17419,United Kingdom
537634,22114,HOT WATER BOTTLE TEA AND SYMPATHY,5,12/7/2010 15:15,3.95,16775,United Kingdom
537634,21617,4 LILY  BOTANICAL DINNER CANDLES,1,12/7/2010 15:15,3.75,16775,United Kingdom
537646,20762,GREEN FERN SKETCHBOOK ,1,12/7/2010 15:39,3.75,17591,United Kingdom
537646,21903,MAN FLU METAL SIGN,2,12/7/2010 15:39,2.1,17591,United Kingdom
537646,22189,CREAM HEART CARD HOLDER,1,12/7/2010 15:39,3.95,17591,United Kingdom
537648,22064,PINK DOUGHNUT TRINKET POT ,12,12/7/2010 15:48,1.65,12839,United Kingdom
537649,84949,SILVER HANGING T-LIGHT HOLDER,12,12/7/2010 15:48,1.65,13807,United Kingdom
537649,22845,VINTAGE CREAM CAT FOOD CONTAINER,2,12/7/2010 15:48,6.35,13807,United Kingdom
537653,22624,IVORY KITCHEN SCALES,2,12/7/2010 15:54,8.5,17897,United Kingdom
537669,22969,HOMEMADE JAM SCENTED CANDLES,12,12/8/2010 8:58,1.45,16863,United Kingdom
537670,22111,SCOTTIE DOG HOT WATER BOTTLE,24,12/8/2010 9:07,4.25,13078,United Kingdom
537674,21212,PACK OF 72 RETROSPOT CAKE CASES,24,12/8/2010 9:51,0.55,15628,United Kingdom
537685,22731,3D CHRISTMAS STAMPS STICKERS ,6,12/8/2010 10:21,1.25,18077,United Kingdom
537691,47566,PARTY BUNTING,5,12/8/2010 10:39,4.65,13842,United Kingdom
537692,37448,CERAMIC CAKE DESIGN SPOTTED MUG,6,12/8/2010 10:40,1.49,14796,United Kingdom
537692,22932,BAKING MOULD TOFFEE CUP CHOCOLATE,1,12/8/2010 10:40,2.55,14796,United Kingdom
537751,22771,CLEAR DRAWER KNOB ACRYLIC EDWARDIAN,12,12/8/2010 11:04,1.25,17706,United Kingdom
537754,47559B,TEA TIME OVEN GLOVE,1,12/8/2010 11:16,1.25,16081,United Kingdom
537759,22795,SWEETHEART RECIPE BOOK STAND,2,12/8/2010 11:42,6.75,13126,United Kingdom
537764,84836,ZINC METAL HEART DECORATION,2,12/8/2010 12:06,1.25,16893,United Kingdom
537764,20686,DOLLY MIXTURE CHILDREN'S UMBRELLA,1,12/8/2010 12:06,3.25,16893,United Kingdom
537764,22586,FELTCRAFT HAIRBAND PINK AND BLUE,1,12/8/2010 12:06,0.85,16893,United Kingdom
537765,20770,ABSTRACT CIRCLE JOURNAL ,1,12/8/2010 12:08,2.55,14606,United Kingdom
537772,84912A,PINK ROSE WASHBAG,1,12/8/2010 12:35,3.75,18043,United Kingdom
537773,22457,NATURAL SLATE HEART CHALKBOARD ,6,12/8/2010 12:36,2.95,16016,United Kingdom
537775,21830,ASSORTED CREEPY CRAWLIES,24,12/8/2010 12:41,0.42,17722,United Kingdom
537775,22986,GINGHAM ROSE WRAP,25,12/8/2010 12:41,0.42,17722,United Kingdom
537781,22585,PACK OF 6 BIRDY GIFT TAGS,3,12/8/2010 12:46,1.25,17341,United Kingdom
537781,21375,LARGE CAMPHOR WOOD FIELD MUSHROOM ,1,12/8/2010 12:46,5.45,17341,United Kingdom
537802,21055,TOOL BOX SOFT TOY ,2,12/8/2010 13:11,8.95,13455,United Kingdom
537803,90184B,AMETHYST CHUNKY BEAD BRACELET W STR,5,12/8/2010 13:14,8.95,15916,United Kingdom
537806,22423,REGENCY CAKESTAND 3 TIER,16,12/8/2010 13:21,10.95,13113,United Kingdom
537818,22513,DOORSTOP FOOTBALL DESIGN,4,12/8/2010 13:53,3.75,12766,Portugal
537825,22197,SMALL POPCORN HOLDER,13,12/8/2010 14:36,0.85,15005,United Kingdom
537826,21291,SMALL POLKADOT CHOCOLATE GIFT BAG ,16,12/8/2010 14:38,0.85,15581,United Kingdom
537828,22587,FELTCRAFT HAIRBAND RED AND BLUE,12,12/8/2010 14:43,0.85,15680,United Kingdom
537831,85123A,WHITE HANGING HEART T-LIGHT HOLDER,6,12/8/2010 14:50,2.95,17894,United Kingdom
537843,22855,FINE WICKER HEART ,12,12/8/2010 15:16,1.25,15713,United Kingdom
537845,22119,PEACE WOODEN BLOCK LETTERS,3,12/8/2010 15:23,6.95,17690,United Kingdom
537852,22112,CHOCOLATE HOT WATER BOTTLE,4,12/8/2010 15:56,4.95,17340,United Kingdom
537859,21124,SET/10 BLUE POLKADOT PARTY CANDLES,2,12/8/2010 16:11,1.25,14030,United Kingdom
537862,22580,ADVENT CALENDAR GINGHAM SACK,3,12/8/2010 16:21,5.95,12971,United Kingdom
537865,22943,CHRISTMAS LIGHTS 10 VINTAGE BAUBLES,4,12/8/2010 16:34,4.95,16011,United Kingdom
537867,22781,GUMBALL MAGAZINE RACK,2,12/8/2010 16:48,7.65,16717,United Kingdom
537871,21866,UNION JACK FLAG LUGGAGE TAG,2,12/8/2010 17:20,1.25,12748,United Kingdom
537884,22041,"RECORD FRAME 7"" SINGLE SIZE ",12,12/9/2010 9:30,2.55,15694,United Kingdom
