InvoiceNo,StockCode,Description,Quantity,InvoiceDate,UnitPrice,CustomerID,Country
561258,22030,SWALLOWS GREETING CARD,24,7/26/2011 12:03,0.42,15513,United Kingdom
561280,21494,ROTATING LEAVES T-LIGHT HOLDER,12,7/26/2011 12:24,1.25,18211,United Kingdom
561295,20726,LUNCH BAG WOODLAND,1,7/26/2011 12:28,1.65,15311,United Kingdom
561324,82616C,MIDNIGHT GLAMOUR SCARF KNITTING KIT,12,7/26/2011 13:45,1.25,14414,United Kingdom
561331,23206,LUNCH BAG APPLE DESIGN,4,7/26/2011 14:24,1.65,16809,United Kingdom
561352,22086,PAPER CHAIN KIT 50'S CHRISTMAS ,12,7/26/2011 14:41,2.95,18094,United Kingdom
561355,22139,RETROSPOT TEA SET CERAMIC 11 PC ,24,7/26/2011 14:51,4.25,13090,United Kingdom
561359,22356,CHARLOTTE BAG PINK POLKADOT,20,7/26/2011 15:29,0.85,17160,United Kingdom
561363,20677,PINK POLKADOT BOWL,8,7/26/2011 15:42,1.25,17238,United Kingdom
561363,47343A,FUSCHIA FLOWER PURSE WITH BEADS,4,7/26/2011 15:42,0.83,17238,United Kingdom
561382,85048,15CM CHRISTMAS GLASS BALL 20 LIGHTS,3,7/26/2011 17:27,7.95,16750,United Kingdom
561385,22333,RETROSPOT PARTY BAG + STICKER SET,8,7/27/2011 9:13,1.65,15660,United Kingdom
561388,23229,VINTAGE DONKEY TAIL GAME ,36,7/27/2011 9:32,3.39,12753,Japan
561390,23201,JUMBO BAG ALPHABET,10,7/27/2011 9:52,2.08,17068,United Kingdom
561398,21976,PACK OF 60 MUSHROOM CAKE CASES,24,7/27/2011 10:52,0.55,16767,United Kingdom
561399,23013,GLASS APOTHECARY BOTTLE TONIC,12,7/27/2011 10:53,3.45,15125,United Kingdom
561430,22144,CHRISTMAS CRAFT LITTLE FRIENDS,6,7/27/2011 11:29,2.1,15172,United Kingdom
561473,21931,JUMBO STORAGE BAG SUKI,10,7/27/2011 13:17,2.08,15078,United Kingdom
561485,21137,BLACK RECORD COVER FRAME,5,7/27/2011 13:42,3.75,17841,United Kingdom
561485,20622,VIP PASSPORT COVER ,4,7/27/2011 13:42,2.1,17841,United Kingdom
561488,21116,OWL DOORSTOP,3,7/27/2011 13:51,4.95,16609,United Kingdom
561507,23346,SPACEBOY BEAKER,12,7/27/2011 14:21,1.25,12397,Belgium
561508,47566,PARTY BUNTING,20,7/27/2011 14:23,4.95,16696,United Kingdom
561512,22993,SET OF 4 PANTRY JELLY MOULDS,5,7/27/2011 15:09,1.25,14534,United Kingdom
561512,47590B,PINK HAPPY BIRTHDAY BUNTING,2,7/27/2011 15:09,5.45,14534,United Kingdom
561519,23318,BOX OF 6 MINI VINTAGE CRACKERS,1,7/27/2011 17:01,2.49,17870,United Kingdom
561534,82494L,WOODEN FRAME ANTIQUE WHITE ,6,7/28/2011 9:45,2.95,14307,United Kingdom
561537,23051,RECYCLED ACAPULCO MAT BLUE,2,7/28/2011 9:58,8.25,13870,United Kingdom
561585,48194,DOORMAT HEARTS,2,7/28/2011 10:46,7.95,13728,United Kingdom
561595,23153,ZINC SWEETHEART WIRE LETTER RACK,8,7/28/2011 11:22,3.75,12853,United Kingdom
561600,22344,PARTY PIZZA DISH PINK POLKADOT,3,7/28/2011 11:29,0.85,15861,United Kingdom
561600,23205,CHARLOTTE BAG VINTAGE ALPHABET ,7,7/28/2011 11:29,0.85,15861,United Kingdom
561603,23050,RECYCLED ACAPULCO MAT GREEN,4,7/28/2011 12:06,8.25,14855,United Kingdom
561614,23342,MINT DINER WALL CLOCK,2,7/28/2011 12:50,8.5,13871,United Kingdom
561625,85099F,JUMBO BAG STRAWBERRY,10,7/28/2011 14:03,2.08,16843,United Kingdom
561626,22531,MAGIC DRAWING SLATE CIRCUS PARADE  ,2,7/28/2011 14:03,0.42,14898,United Kingdom
561631,22189,CREAM HEART CARD HOLDER,4,7/28/2011 14:27,3.95,14911,EIRE
561631,22697,GREEN REGENCY TEACUP AND SAUCER,6,7/28/2011 14:27,2.95,14911,EIRE
561632,22817,CARD SUKI BIRTHDAY,24,7/28/2011 14:30,0.42,15639,United Kingdom
561633,23170,REGENCY TEA PLATE ROSES ,384,7/28/2011 14:33,1.45,17949,United Kingdom
561636,23209,LUNCH BAG DOILEY PATTERN ,60,7/28/2011 14:36,1.65,12910,United Kingdom
561642,23236,DOILEY STORAGE TIN,2,7/28/2011 15:04,2.89,17965,United Kingdom
561642,22376,AIRLINE BAG VINTAGE JET SET WHITE,1,7/28/2011 15:04,4.25,17965,United Kingdom
561642,22903,CALENDAR FAMILY FAVOURITES,3,7/28/2011 15:04,2.95,17965,United Kingdom
561650,23201,JUMBO BAG ALPHABET,10,7/28/2011 15:31,2.08,15329,United Kingdom
561658,21592,RETROSPOT CIGAR BOX MATCHES ,1,7/28/2011 16:06,1.25,12743,Unspecified
561658,23268,SET OF 2 CERAMIC CHRISTMAS REINDEER,1,7/28/2011 16:06,1.45,12743,Unspecified
561658,22585,PACK OF 6 BIRDY GIFT TAGS,1,7/28/2011 16:06,1.25,12743,Unspecified
561670,84828,JUNGLE POPSICLES ICE LOLLY MOULDS,12,7/28/2011 17:15,1.25,17373,United Kingdom
561689,22420,LIPSTICK PEN BABY PINK,24,7/29/2011 9:01,0.42,15942,United Kingdom
561690,20727,LUNCH BAG  BLACK SKULL.,10,7/29/2011 9:11,1.65,13875,United Kingdom
561693,71459,HANGING JAM JAR T-LIGHT HOLDER,12,7/29/2011 9:48,0.85,15120,United Kingdom
561694,22625,RED KITCHEN SCALES,2,7/29/2011 9:57,8.5,16147,United Kingdom
561695,84987,SET OF 36 TEATIME PAPER DOILIES,12,7/29/2011 10:00,1.45,14005,United Kingdom
561697,85123A,WHITE HANGING HEART T-LIGHT HOLDER,6,7/29/2011 10:06,2.95,18127,United Kingdom
561704,21912,VINTAGE SNAKES & LADDERS,1,7/29/2011 11:07,3.75,14606,United Kingdom
561710,22844,VINTAGE CREAM DOG FOOD CONTAINER,1,7/29/2011 11:45,8.5,13827,United Kingdom
561712,23322,LARGE WHITE HEART OF WICKER,2,7/29/2011 11:49,2.95,14499,United Kingdom
561713,22935,BAKING MOULD ROSE MILK CHOCOLATE,20,7/29/2011 11:56,3.25,12901,United Kingdom
561719,47566,PARTY BUNTING,4,7/29/2011 12:09,4.95,17519,United Kingdom
561773,22487,WHITE WOOD GARDEN PLANT LADDER,2,7/29/2011 12:41,9.95,17841,United Kingdom
561773,21439,BASKET OF TOADSTOOLS,1,7/29/2011 12:41,1.25,17841,United Kingdom
561773,22386,JUMBO BAG PINK POLKADOT,1,7/29/2011 12:41,2.08,17841,United Kingdom
561773,22854,CREAM SWEETHEART EGG HOLDER,1,7/29/2011 12:41,4.95,17841,United Kingdom
561783,21507,"ELEPHANT, BIRTHDAY CARD, ",12,7/29/2011 12:50,0.42,16062,United Kingdom
561795,22895,SET OF 2 TEA TOWELS APPLE AND PEARS,6,7/29/2011 13:28,3.25,12716,France
561796,22586,FELTCRAFT HAIRBAND PINK AND BLUE,12,7/29/2011 13:34,0.85,13138,United Kingdom
561797,20726,LUNCH BAG WOODLAND,30,7/29/2011 13:37,1.65,13178,United Kingdom
561799,23155,KNICKERBOCKERGLORY MAGNET ASSORTED ,12,7/29/2011 13:46,0.83,15776,United Kingdom
561806,23202,JUMBO BAG VINTAGE LEAF,10,7/29/2011 14:55,2.08,12839,United Kingdom
561807,23203,JUMBO BAG DOILEY PATTERNS,10,7/29/2011 15:02,2.08,17491,United Kingdom
561807,22670,FRENCH WC SIGN BLUE METAL,12,7/29/2011 15:02,1.25,17491,United Kingdom
561808,23204,CHARLOTTE BAG APPLES DESIGN,10,7/29/2011 15:11,0.85,13534,United Kingdom
561808,85099B,JUMBO BAG RED RETROSPOT,20,7/29/2011 15:11,2.08,13534,United Kingdom
561808,23344,JUMBO BAG 50'S CHRISTMAS ,10,7/29/2011 15:11,2.08,13534,United Kingdom
561817,85099B,JUMBO BAG RED RETROSPOT,10,7/29/2011 15:51,2.08,12921,United Kingdom
561818,23132,SMALL IVORY HEART WALL ORGANISER,1,7/29/2011 15:51,5.75,16775,United Kingdom
561857,22548,HEADS AND TAILS SPORTING FUN,12,7/29/2011 16:24,1.25,13004,United Kingdom
561867,22999,TRAVEL CARD WALLET VINTAGE LEAF,3,7/31/2011 10:59,0.42,16931,United Kingdom
561867,21881,CUTE CATS TAPE,1,7/31/2011 10:59,0.65,16931,United Kingdom
561868,22123,PING MICROWAVE APRON,3,7/31/2011 11:26,1.95,16813,United Kingdom
561868,84519B,CARROT CHARLIE+LOLA COASTER SET,3,7/31/2011 11:26,1.25,16813,United Kingdom
561869,23322,LARGE WHITE HEART OF WICKER,1,7/31/2011 11:38,2.95,16764,United Kingdom
561869,23243,SET OF TEA COFFEE SUGAR TINS PANTRY,1,7/31/2011 11:38,4.95,16764,United Kingdom
561870,22457,NATURAL SLATE HEART CHALKBOARD ,6,7/31/2011 11:45,2.95,14911,EIRE
561870,22556,PLASTERS IN TIN CIRCUS PARADE ,12,7/31/2011 11:45,1.65,14911,EIRE
561870,84991,60 TEATIME FAIRY CAKE CASES,24,7/31/2011 11:45,0.55,14911,EIRE
561873,22570,FELTCRAFT CUSHION RABBIT,24,7/31/2011 11:48,3.39,13316,United Kingdom
561873,22569,FELTCRAFT CUSHION BUTTERFLY,24,7/31/2011 11:48,3.39,13316,United Kingdom
561874,23338,EGG FRYING PAN RED ,2,7/31/2011 12:02,2.08,16255,United Kingdom
561874,21041,RED RETROSPOT OVEN GLOVE DOUBLE,1,7/31/2011 12:02,2.95,16255,United Kingdom
561876,84879,ASSORTED COLOUR BIRD ORNAMENT,16,7/31/2011 12:08,1.69,14472,United Kingdom
561877,21981,PACK OF 12 WOODLAND TISSUES ,12,7/31/2011 12:16,0.29,16401,United Kingdom
561878,20829,GLITTER HANGING BUTTERFLY STRING,4,7/31/2011 12:34,2.1,17388,United Kingdom
561881,23209,LUNCH BAG DOILEY PATTERN ,10,7/31/2011 12:47,1.65,16477,United Kingdom
561884,82482,WOODEN PICTURE FRAME WHITE FINISH,1,7/31/2011 13:07,2.55,15453,United Kingdom
561885,21063,PARTY INVITES JAZZ HEARTS,2,7/31/2011 13:13,0.85,15532,United Kingdom
561885,85039B,S/4 IVORY MINI ROSE CANDLE IN BOWL,1,7/31/2011 13:13,1.65,15532,United Kingdom
561885,21428,SET3 BOOK BOX GREEN GINGHAM FLOWER ,1,7/31/2011 13:13,4.25,15532,United Kingdom
561887,21403,BLUE EGG  SPOON,24,7/31/2011 13:33,0.12,14414,United Kingdom
561888,22904,CALENDAR PAPER CUT DESIGN,6,7/31/2011 13:36,2.95,14092,United Kingdom
561890,23295,SET OF 12 MINI LOAF BAKING CASES,24,7/31/2011 14:17,0.83,12697,Sweden
561893,21428,SET3 BOOK BOX GREEN GINGHAM FLOWER ,1,7/31/2011 14:39,4.25,12942,United Kingdom
561894,22561,WOODEN SCHOOL COLOURING SET,1,7/31/2011 15:00,1.65,14456,United Kingdom
561894,23121,PACK OF 6 COCKTAIL PARASOL STRAWS,1,7/31/2011 15:00,0.42,14456,United Kingdom
561894,22328,ROUND SNACK BOXES SET OF 4 FRUITS ,1,7/31/2011 15:00,2.95,14456,United Kingdom
561894,22972,CHILDREN'S SPACEBOY MUG,1,7/31/2011 15:00,1.65,14456,United Kingdom
561894,21260,FIRST AID TIN,1,7/31/2011 15:00,3.25,14456,United Kingdom
561897,47559B,TEA TIME OVEN GLOVE,1,7/31/2011 15:24,1.25,17841,United Kingdom
561897,22684,FRENCH BLUE METAL DOOR SIGN 9,1,7/31/2011 15:24,1.25,17841,United Kingdom
561898,22077,6 RIBBONS RUSTIC CHARM,12,7/31/2011 15:25,1.65,12456,Switzerland
561900,23297,SET 40 HEART SHAPE PETIT FOUR CASES,8,7/31/2011 15:31,1.65,16655,United Kingdom
561901,22950,36 DOILIES VINTAGE CHRISTMAS,288,7/31/2011 15:42,1.45,14156,EIRE
561907,23233,WRAP POPPIES  DESIGN,25,8/1/2011 10:08,0.42,14060,United Kingdom
561909,22966,GINGERBREAD MAN COOKIE CUTTER,12,8/1/2011 10:23,1.25,15625,United Kingdom
561911,21578,WOODLAND DESIGN  COTTON TOTE BAG,6,8/1/2011 10:26,2.25,12534,Germany
561911,84819,DANISH ROSE ROUND SEWING BOX,3,8/1/2011 10:26,4.25,12534,Germany
561911,15058A,BLUE POLKADOT GARDEN PARASOL,2,8/1/2011 10:26,7.95,12534,Germany
561911,21669,BLUE STRIPE CERAMIC DRAWER KNOB,12,8/1/2011 10:26,1.25,12534,Germany
561915,22895,SET OF 2 TEA TOWELS APPLE AND PEARS,1,8/1/2011 11:23,3.25,14408,United Kingdom
561917,21931,JUMBO STORAGE BAG SUKI,1,8/1/2011 11:57,2.08,16904,United Kingdom
561923,23204,CHARLOTTE BAG APPLES DESIGN,10,8/1/2011 12:16,0.85,14112,United Kingdom
561923,22139,RETROSPOT TEA SET CERAMIC 11 PC ,3,8/1/2011 12:16,4.95,14112,United Kingdom
561933,21390,FILIGRIS HEART WITH BUTTERFLY,24,8/1/2011 12:56,1.25,12949,United Kingdom
561967,22185,SLATE TILE NATURAL HANGING,5,8/1/2011 13:11,1.65,12844,United Kingdom
561967,23306,SET OF 36 DOILIES PANTRY DESIGN,3,8/1/2011 13:11,1.45,12844,United Kingdom
561969,22676,FRENCH BLUE METAL DOOR SIGN 1,4,8/1/2011 13:31,1.25,17757,United Kingdom
561995,84929,ASSTD FRUIT+FLOWERS FRIDGE MAGNETS,240,8/1/2011 13:44,0.19,16133,United Kingdom
561995,22961,JAM MAKING SET PRINTED,12,8/1/2011 13:44,1.45,16133,United Kingdom
562031,84926A,WAKE UP COCKEREL TILE COASTER,24,8/1/2011 17:37,0.29,16984,United Kingdom
562031,21390,FILIGRIS HEART WITH BUTTERFLY,24,8/1/2011 17:37,1.25,16984,United Kingdom
562031,22219,LOVEBIRD HANGING DECORATION WHITE ,6,8/1/2011 17:37,0.85,16984,United Kingdom
562031,22364,GLASS JAR DIGESTIVE BISCUITS,2,8/1/2011 17:37,2.95,16984,United Kingdom
562031,22997,TRAVEL CARD WALLET UNION JACK,3,8/1/2011 17:37,0.42,16984,United Kingdom
562031,22427,ENAMEL FLOWER JUG CREAM,2,8/1/2011 17:37,5.95,16984,United Kingdom
562031,22854,CREAM SWEETHEART EGG HOLDER,3,8/1/2011 17:37,4.95,16984,United Kingdom
562031,21932,SCANDINAVIAN PAISLEY PICNIC BAG,1,8/1/2011 17:37,1.65,16984,United Kingdom
562033,23174,REGENCY SUGAR BOWL GREEN,12,8/2/2011 8:49,4.15,15410,United Kingdom
562033,48138,DOORMAT UNION FLAG,4,8/2/2011 8:49,7.95,15410,United Kingdom
562034,22328,ROUND SNACK BOXES SET OF 4 FRUITS ,6,8/2/2011 9:14,2.95,12449,Belgium
562035,22277,COSMETIC BAG VINTAGE ROSE PAISLEY,6,8/2/2011 9:29,2.1,12627,Germany
562040,79321,CHILLI LIGHTS,48,8/2/2011 10:00,4.95,17553,United Kingdom
562042,22158,3 HEARTS HANGING DECORATION RUSTIC,16,8/2/2011 10:19,2.95,13075,United Kingdom
562042,23168,CLASSIC CAFE SUGAR DISPENSER,12,8/2/2011 10:19,1.25,13075,United Kingdom
562046,20685,DOORMAT RED RETROSPOT,2,8/2/2011 10:34,7.95,12378,Switzerland
562046,21936,RED RETROSPOT PICNIC BAG,5,8/2/2011 10:34,2.95,12378,Switzerland
562046,22430,ENAMEL WATERING CAN CREAM,4,8/2/2011 10:34,4.95,12378,Switzerland
562046,23223,CHRISTMAS TREE HANGING SILVER ,12,8/2/2011 10:34,0.83,12378,Switzerland
562046,23207,LUNCH BAG ALPHABET DESIGN,10,8/2/2011 10:34,1.65,12378,Switzerland
562046,22631,CIRCUS PARADE LUNCH BOX ,12,8/2/2011 10:34,1.95,12378,Switzerland
562046,21205,MULTICOLOUR 3D BALLS GARLAND,6,8/2/2011 10:34,2.55,12378,Switzerland
562085,22964,3 PIECE SPACEBOY COOKIE CUTTER SET,6,8/2/2011 12:27,2.1,15228,United Kingdom
562087,22171,3 HOOK PHOTO SHELF ANTIQUE WHITE,1,8/2/2011 12:31,8.5,14606,United Kingdom
562087,21231,SWEETHEART CERAMIC TRINKET BOX,1,8/2/2011 12:31,1.25,14606,United Kingdom
562096,22755,SMALL PURPLE BABUSHKA NOTEBOOK ,2,8/2/2011 13:16,0.85,15311,United Kingdom
562098,21930,JUMBO STORAGE BAG SKULLS,10,8/2/2011 13:31,2.08,14315,United Kingdom
562101,23234,BISCUIT TIN VINTAGE CHRISTMAS,6,8/2/2011 14:04,2.89,13850,United Kingdom
562101,23373,VINTAGE CHRISTMAS PAPER GIFT BAG,10,8/2/2011 14:04,0.82,13850,United Kingdom
562101,22726,ALARM CLOCK BAKELIKE GREEN,4,8/2/2011 14:04,3.75,13850,United Kingdom
562101,23340,VINTAGE CHRISTMAS CAKE FRILL,12,8/2/2011 14:04,1.65,13850,United Kingdom
562102,22030,SWALLOWS GREETING CARD,12,8/2/2011 14:21,0.42,13089,United Kingdom
562102,21746,SMALL RED RETROSPOT WINDMILL,12,8/2/2011 14:21,1.25,13089,United Kingdom
562105,23133,LARGE IVORY HEART WALL ORGANISER,2,8/2/2011 14:50,8.25,15271,United Kingdom
562106,84192,ASSORTED COLOUR METAL CAT ,1,8/2/2011 15:19,1.25,14076,United Kingdom
562108,22333,RETROSPOT PARTY BAG + STICKER SET,2,8/2/2011 15:40,1.65,17809,United Kingdom
562109,21936,RED RETROSPOT PICNIC BAG,50,8/2/2011 15:42,2.55,13798,United Kingdom
562125,22274,FELTCRAFT DOLL EMILY,1,8/2/2011 17:29,2.95,17887,United Kingdom
562127,79163,BLACK CHAMPAGNE GLASS,48,8/3/2011 8:21,0.39,13717,United Kingdom
562129,85123A,WHITE HANGING HEART T-LIGHT HOLDER,6,8/3/2011 9:09,2.95,13186,United Kingdom
562138,21534,DAIRY MAID LARGE MILK JUG,12,8/3/2011 10:04,4.25,14737,United Kingdom
562146,23203,JUMBO BAG DOILEY PATTERNS,10,8/3/2011 10:45,2.08,17675,United Kingdom
562146,21465,PINK FLOWER CROCHET FOOD COVER,6,8/3/2011 10:45,3.75,17675,United Kingdom
562146,21933,PINK VINTAGE PAISLEY PICNIC BAG,10,8/3/2011 10:45,1.65,17675,United Kingdom
562150,22149,FELTCRAFT 6 FLOWER FRIENDS,6,8/3/2011 10:49,2.1,14132,United Kingdom
562153,22564,ALPHABET STENCIL CRAFT,24,8/3/2011 11:21,1.06,14088,United Kingdom
562157,22750,FELTCRAFT PRINCESS LOLA DOLL,2,8/3/2011 11:44,3.75,16012,United Kingdom
562157,23170,REGENCY TEA PLATE ROSES ,14,8/3/2011 11:44,1.65,16012,United Kingdom
562162,23002,TRAVEL CARD WALLET SKULLS,4,8/3/2011 12:03,0.42,12841,United Kingdom
562166,22491,PACK OF 12 COLOURED PENCILS,12,8/3/2011 12:10,0.85,13209,United Kingdom
562166,22631,CIRCUS PARADE LUNCH BOX ,12,8/3/2011 12:10,1.95,13209,United Kingdom
562173,21745,GAOLERS KEYS DECORATIVE GARDEN ,2,8/3/2011 12:12,3.75,14530,United Kingdom
562199,21232,STRAWBERRY CERAMIC TRINKET BOX,2,8/3/2011 12:20,1.25,12748,United Kingdom
562201,23202,JUMBO BAG VINTAGE LEAF,2,8/3/2011 12:31,2.08,14527,United Kingdom
562204,84755,COLOUR GLASS T-LIGHT HOLDER HANGING,8,8/3/2011 12:54,0.65,16324,United Kingdom
562204,22961,JAM MAKING SET PRINTED,2,8/3/2011 12:54,1.45,16324,United Kingdom
562204,21089,SET/6 GREEN SPRING PAPER CUPS,4,8/3/2011 12:54,0.19,16324,United Kingdom
562204,22089,PAPER BUNTING VINTAGE PAISLEY,2,8/3/2011 12:54,2.95,16324,United Kingdom
562205,82483,WOOD 2 DRAWER CABINET WHITE FINISH,4,8/3/2011 12:55,6.95,18055,United Kingdom
562205,82486,WOOD S/3 CABINET ANT WHITE FINISH,4,8/3/2011 12:55,8.95,18055,United Kingdom
562210,84580,MOUSE TOY WITH PINK T-SHIRT,4,8/3/2011 13:10,3.75,13486,United Kingdom
562210,22150,3 STRIPEY MICE FELTCRAFT,6,8/3/2011 13:10,1.95,13486,United Kingdom
562211,20914,SET/5 RED RETROSPOT LID GLASS BOWLS,12,8/3/2011 13:22,2.95,17429,United Kingdom
562213,23240,SET OF 4 KNICK KNACK TINS DOILEY ,1,8/3/2011 13:39,4.15,13975,United Kingdom
562213,20971,PINK BLUE FELT CRAFT TRINKET BOX,3,8/3/2011 13:39,1.25,13975,United Kingdom
562213,21977,PACK OF 60 PINK PAISLEY CAKE CASES,6,8/3/2011 13:39,0.55,13975,United Kingdom
562214,23236,DOILEY STORAGE TIN,6,8/3/2011 13:39,2.89,17731,United Kingdom
562222,22178,VICTORIAN GLASS HANGING T-LIGHT,192,8/3/2011 14:33,1.06,18073,United Kingdom
562256,22842,BISCUIT TIN VINTAGE RED,2,8/3/2011 15:14,6.75,15152,United Kingdom
562256,85054,FRENCH ENAMEL POT W LID,6,8/3/2011 15:14,2.95,15152,United Kingdom
562258,21086,SET/6 RED SPOTTY PAPER CUPS,2,8/3/2011 15:28,0.65,16348,United Kingdom
562260,23204,CHARLOTTE BAG APPLES DESIGN,30,8/3/2011 15:38,0.85,13408,United Kingdom
562263,85123A,WHITE HANGING HEART T-LIGHT HOLDER,2,8/3/2011 15:45,2.95,17514,United Kingdom
562269,22623,BOX OF VINTAGE JIGSAW BLOCKS ,1,8/3/2011 16:35,5.95,14056,United Kingdom
562269,22494,EMERGENCY FIRST AID TIN ,2,8/3/2011 16:35,1.25,14056,United Kingdom
562271,15039,SANDALWOOD FAN,7,8/3/2011 17:05,0.85,16098,United Kingdom
562276,84991,60 TEATIME FAIRY CAKE CASES,24,8/4/2011 10:23,0.55,17735,United Kingdom
562276,22327,ROUND SNACK BOXES SET OF 4 SKULLS,6,8/4/2011 10:23,2.95,17735,United Kingdom
562313,22620,4 TRADITIONAL SPINNING TOPS,12,8/4/2011 11:38,1.45,14640,United Kingdom
562313,22752,SET 7 BABUSHKA NESTING BOXES,2,8/4/2011 11:38,8.5,14640,United Kingdom
562339,22084,PAPER CHAIN KIT EMPIRE,1,8/4/2011 11:59,2.95,13571,United Kingdom
562340,84997D,CHILDRENS CUTLERY POLKADOT PINK,4,8/4/2011 12:05,4.15,13985,United Kingdom
562341,85071C,"CHARLIE+LOLA""EXTREMELY BUSY"" SIGN",1,8/4/2011 12:13,0.39,15005,United Kingdom
562345,84976,RECTANGULAR SHAPED MIRROR,24,8/4/2011 12:14,0.79,13694,United Kingdom
562345,22993,SET OF 4 PANTRY JELLY MOULDS,72,8/4/2011 12:14,1.06,13694,United Kingdom
562347,22558,CLOTHES PEGS RETROSPOT PACK 24 ,1,8/4/2011 12:22,1.65,13263,United Kingdom
562347,84596L,BISCUITS SMALL BOWL LIGHT BLUE,2,8/4/2011 12:22,0.42,13263,United Kingdom
562348,22197,POPCORN HOLDER,100,8/4/2011 12:36,0.72,17511,United Kingdom
562348,21519,GIN & TONIC DIET GREETING CARD ,72,8/4/2011 12:36,0.36,17511,United Kingdom
562353,23209,LUNCH BAG DOILEY PATTERN ,20,8/4/2011 13:15,1.65,16180,United Kingdom
562353,23231,WRAP DOILEY DESIGN,25,8/4/2011 13:15,0.42,16180,United Kingdom
562354,21394,RED POLKADOT BEAKER ,48,8/4/2011 13:15,0.39,17470,United Kingdom
562365,21823,PAINTED METAL HEART WITH HOLLY BELL,4,8/4/2011 13:51,1.45,14344,United Kingdom
562370,22601,CHRISTMAS RETROSPOT ANGEL WOOD,12,8/4/2011 14:20,0.85,12626,Germany
562370,22352,LUNCH BOX WITH CUTLERY RETROSPOT ,12,8/4/2011 14:20,2.55,12626,Germany
562371,22672,FRENCH BATHROOM SIGN BLUE METAL,12,8/4/2011 14:30,1.65,13709,United Kingdom
562376,85032D,YULETIDE IMAGES GIFT WRAP SET,12,8/4/2011 15:04,0.65,15254,United Kingdom
562377,84978,HANGING HEART JAR T-LIGHT HOLDER,6,8/4/2011 15:04,1.25,14535,United Kingdom
562377,22383,LUNCH BAG SUKI DESIGN ,2,8/4/2011 15:04,1.65,14535,United Kingdom
562378,22907,PACK OF 20 NAPKINS PANTRY DESIGN,2,8/4/2011 15:07,0.85,15046,United Kingdom
562378,22908,PACK OF 20 NAPKINS RED APPLES,2,8/4/2011 15:07,0.85,15046,United Kingdom
562381,23075,PARLOUR CERAMIC WALL HOOK,8,8/4/2011 15:33,4.15,16873,United Kingdom
562388,22720,SET OF 3 CAKE TINS PANTRY DESIGN ,1,8/4/2011 15:52,4.95,18099,United Kingdom
562389,21915,RED  HARMONICA IN BOX ,12,8/4/2011 15:55,1.25,16531,United Kingdom
562393,22726,ALARM CLOCK BAKELIKE GREEN,8,8/4/2011 16:17,3.75,18172,United Kingdom
562416,23298,SPOTTY BUNTING,3,8/4/2011 16:31,4.95,13969,United Kingdom
562416,23344,JUMBO BAG 50'S CHRISTMAS ,10,8/4/2011 16:31,2.08,13969,United Kingdom
562418,23243,SET OF TEA COFFEE SUGAR TINS PANTRY,4,8/4/2011 16:34,4.95,16572,United Kingdom
562419,20728,LUNCH BAG CARS BLUE,9,8/4/2011 16:36,1.65,14667,United Kingdom
562421,21402,RED  EGG  SPOON,24,8/4/2011 16:41,0.12,15241,United Kingdom
562427,84875B,GREEN SQUARE COMPACT MIRROR,1,8/4/2011 17:19,1.25,17267,United Kingdom
562427,22427,ENAMEL FLOWER JUG CREAM,2,8/4/2011 17:19,5.95,17267,United Kingdom
562429,22730,ALARM CLOCK BAKELIKE IVORY,12,8/4/2011 17:23,3.75,13767,United Kingdom
562430,85066,CREAM SWEETHEART MINI CHEST,2,8/4/2011 17:26,12.75,18109,United Kingdom
562444,22382,LUNCH BAG SPACEBOY DESIGN ,3,8/4/2011 18:44,1.65,14713,United Kingdom
562450,23176,ABC TREASURE BOOK BOX ,8,8/5/2011 8:40,2.25,12562,France
562453,22693,GROW A FLYTRAP OR SUNFLOWER IN TIN,24,8/5/2011 10:31,1.25,18097,United Kingdom
562455,21231,SWEETHEART CERAMIC TRINKET BOX,12,8/5/2011 10:32,1.25,18097,United Kingdom
562457,22561,WOODEN SCHOOL COLOURING SET,24,8/5/2011 11:00,1.65,18079,United Kingdom
562457,22713,CARD I LOVE LONDON ,12,8/5/2011 11:00,0.42,18079,United Kingdom
562465,84991,60 TEATIME FAIRY CAKE CASES,24,8/5/2011 11:46,0.55,13908,United Kingdom
562467,22469,HEART OF WICKER SMALL,12,8/5/2011 11:50,1.65,13513,United Kingdom
562517,22356,CHARLOTTE BAG PINK POLKADOT,3,8/5/2011 12:27,0.85,15719,United Kingdom
562517,23202,JUMBO BAG VINTAGE LEAF,4,8/5/2011 12:27,2.08,15719,United Kingdom
562517,22383,LUNCH BAG SUKI DESIGN ,3,8/5/2011 12:27,1.65,15719,United Kingdom
562519,47504K,ENGLISH ROSE GARDEN SECATEURS,4,8/5/2011 12:37,0.79,16764,United Kingdom
562526,21621,VINTAGE UNION JACK BUNTING,2,8/5/2011 13:46,8.5,16880,United Kingdom
562528,22423,REGENCY CAKESTAND 3 TIER,1,8/5/2011 13:52,12.75,12610,Italy
562528,22379,RECYCLING BAG RETROSPOT ,5,8/5/2011 13:52,2.1,12610,Italy
562528,21936,RED RETROSPOT PICNIC BAG,5,8/5/2011 13:52,2.95,12610,Italy
562537,21238,RED RETROSPOT CUP,8,8/5/2011 15:02,0.85,12517,Germany
562537,23297,SET 40 HEART SHAPE PETIT FOUR CASES,6,8/5/2011 15:02,1.65,12517,Germany
562537,22144,CHRISTMAS CRAFT LITTLE FRIENDS,6,8/5/2011 15:02,2.1,12517,Germany
562540,23232,WRAP VINTAGE LEAF DESIGN,25,8/5/2011 15:38,0.42,17400,United Kingdom
562540,82482,WOODEN PICTURE FRAME WHITE FINISH,2,8/5/2011 15:38,2.55,17400,United Kingdom
562540,22970,LONDON BUS COFFEE MUG,6,8/5/2011 15:38,2.55,17400,United Kingdom
562540,21174,POTTERING IN THE SHED METAL SIGN,3,8/5/2011 15:38,2.08,17400,United Kingdom
562542,22983,CARD BILLBOARD FONT,12,8/5/2011 15:40,0.42,17377,United Kingdom
562549,22467,GUMBALL COAT RACK,12,8/5/2011 16:10,2.55,17092,United Kingdom
562549,23255,CHILDRENS CUTLERY CIRCUS PARADE,4,8/5/2011 16:10,4.15,17092,United Kingdom
562558,22953,BIRTHDAY PARTY CORDON BARRIER TAPE,3,8/5/2011 16:43,1.25,13451,United Kingdom
562560,21559,STRAWBERRY LUNCH BOX WITH CUTLERY,6,8/5/2011 17:12,2.55,14156,EIRE
562560,21790,VINTAGE SNAP CARDS,4,8/5/2011 17:12,0.85,14156,EIRE
562560,23051,RECYCLED ACAPULCO MAT BLUE,1,8/5/2011 17:12,8.25,14156,EIRE
562569,85049D,BRIGHT BLUES RIBBONS ,2,8/7/2011 12:05,1.25,17323,United Kingdom
562569,23203,JUMBO BAG VINTAGE DOILY ,3,8/7/2011 12:05,2.08,17323,United Kingdom
562570,22606,WOODEN SKITTLES GARDEN SET,2,8/7/2011 12:10,15.95,14079,United Kingdom
562574,22118,JOY WOODEN BLOCK LETTERS,1,8/7/2011 12:42,4.95,14903,United Kingdom
562574,21745,GAOLERS KEYS DECORATIVE GARDEN ,4,8/7/2011 12:42,3.75,14903,United Kingdom
562574,22149,FELTCRAFT 6 FLOWER FRIENDS,2,8/7/2011 12:42,2.1,14903,United Kingdom
562575,85123A,WHITE HANGING HEART T-LIGHT HOLDER,6,8/7/2011 12:54,2.95,15411,United Kingdom
562579,23122,PARTY CHARMS 50 PIECES,1,8/7/2011 13:30,0.83,16950,United Kingdom
562579,22507,MEMO BOARD RETROSPOT  DESIGN,4,8/7/2011 13:30,4.95,16950,United Kingdom
562580,22386,JUMBO BAG PINK POLKADOT,10,8/7/2011 13:31,2.08,14024,United Kingdom
562580,85099F,JUMBO BAG STRAWBERRY,10,8/7/2011 13:31,2.08,14024,United Kingdom
562584,22083,PAPER CHAIN KIT RETROSPOT,6,8/7/2011 14:16,2.95,13752,United Kingdom
562587,23201,JUMBO BAG ALPHABET,10,8/7/2011 14:34,2.08,15640,United Kingdom
562587,23306,SET OF 36 DOILIES PANTRY DESIGN,10,8/7/2011 14:34,1.45,15640,United Kingdom
562593,84535B,FAIRY CAKES NOTEBOOK A6 SIZE,4,8/7/2011 15:43,0.65,16549,United Kingdom
562593,23323,WHITE WICKER STAR ,3,8/7/2011 15:43,2.1,16549,United Kingdom
562593,85199S,SMALL HANGING IVORY/RED WOOD BIRD,6,8/7/2011 15:43,0.42,16549,United Kingdom
562593,21071,VINTAGE BILLBOARD DRINK ME MUG,2,8/7/2011 15:43,1.25,16549,United Kingdom
562593,23215,JINGLE BELL HEART ANTIQUE SILVER,6,8/7/2011 15:43,2.08,16549,United Kingdom
562596,23295,SET OF 12 MINI LOAF BAKING CASES,8,8/8/2011 9:22,0.83,16145,United Kingdom
562596,22196,SMALL HEART MEASURING SPOONS,12,8/8/2011 9:22,0.85,16145,United Kingdom
562602,22844,VINTAGE CREAM DOG FOOD CONTAINER,2,8/8/2011 10:11,8.5,12865,Austria
562602,22665,RECIPE BOX BLUE SKETCHBOOK DESIGN,6,8/8/2011 10:11,2.95,12865,Austria
562602,22846,BREAD BIN DINER STYLE RED ,2,8/8/2011 10:11,16.95,12865,Austria
562603,22993,SET OF 4 PANTRY JELLY MOULDS,6,8/8/2011 10:40,1.25,17870,United Kingdom
562608,20728,LUNCH BAG CARS BLUE,10,8/8/2011 11:45,1.65,15502,United Kingdom
562616,85227,SET OF 6 3D KIT CARDS FOR KIDS,12,8/8/2011 12:28,0.85,14748,United Kingdom
562619,22670,FRENCH WC SIGN BLUE METAL,5,8/8/2011 12:34,1.25,15311,United Kingdom
562619,47310M,SMALL POP BOX FUNKY MONKEY,3,8/8/2011 12:34,1.25,15311,United Kingdom
562621,23202,JUMBO BAG VINTAGE LEAF,10,8/8/2011 12:36,2.08,14415,United Kingdom
562670,22139,RETROSPOT TEA SET CERAMIC 11 PC ,3,8/8/2011 13:42,4.95,14911,EIRE
562670,22914,BLUE COAT RACK PARIS FASHION,3,8/8/2011 13:42,4.95,14911,EIRE
562670,22979,PANTRY WASHING UP BRUSH,12,8/8/2011 13:42,1.45,14911,EIRE
562670,22716,CARD CIRCUS PARADE,12,8/8/2011 13:42,0.42,14911,EIRE
