InvoiceNo,StockCode,Description,Quantity,InvoiceDate,UnitPrice,CustomerID,Country
549014,22892,SET OF SALT AND PEPPER TOADSTOOLS,1,4/5/2011 15:00,1.25,17841,United Kingdom
549014,22652,TRAVEL SEWING KIT,1,4/5/2011 15:00,1.65,17841,United Kingdom
549014,23000,TRAVEL CARD WALLET TRANSPORT,1,4/5/2011 15:00,0.42,17841,United Kingdom
549014,22356,CHARLOTTE BAG PINK POLKADOT,7,4/5/2011 15:00,0.85,17841,United Kingdom
549014,20972,PINK CREAM FELT CRAFT TRINKET BOX ,1,4/5/2011 15:00,1.25,17841,United Kingdom
549048,21260,FIRST AID TIN,8,4/6/2011 10:14,3.25,17811,United Kingdom
549053,22231,JIGSAW TREE WITH BIRDHOUSE,12,4/6/2011 10:20,1.45,13863,United Kingdom
549059,21043,APRON MODERN VINTAGE COTTON,3,4/6/2011 10:46,1.95,15529,United Kingdom
549099,47566B,TEA TIME PARTY BUNTING,3,4/6/2011 11:07,4.95,16241,United Kingdom
549099,21169,YOU'RE CONFUSING ME METAL SIGN ,1,4/6/2011 11:07,1.69,16241,United Kingdom
549101,20782,CAMOUFLAGE EAR MUFF HEADPHONES,1,4/6/2011 11:34,5.49,14606,United Kingdom
549115,22629,SPACEBOY LUNCH BOX ,24,4/6/2011 12:41,1.95,13098,United Kingdom
549120,21733,RED HANGING HEART T-LIGHT HOLDER,2,4/6/2011 13:28,2.95,14587,United Kingdom
549121,21320,GLASS CHALICE GREEN  LARGE ,6,4/6/2011 13:33,0.79,17140,United Kingdom
549123,22998,TRAVEL CARD WALLET KEEP CALM,24,4/6/2011 14:02,0.42,15201,United Kingdom
549127,23052,RECYCLED ACAPULCO MAT TURQUOISE,1,4/6/2011 14:23,8.25,14403,United Kingdom
549128,22771,CLEAR DRAWER KNOB ACRYLIC EDWARDIAN,5,4/6/2011 14:25,1.25,16713,United Kingdom
549129,22439,6 ROCKET BALLOONS ,10,4/6/2011 14:53,0.65,17042,United Kingdom
549130,20676,RED RETROSPOT BOWL,6,4/6/2011 15:02,1.25,14701,United Kingdom
549148,84674,FLYING PIG WATERING CAN,1,4/6/2011 15:31,2.95,14534,United Kingdom
549153,84988,SET OF 72 PINK HEART PAPER DOILIES,12,4/6/2011 15:47,1.45,13771,United Kingdom
549153,21584,RETROSPOT SMALL TUBE MATCHES,20,4/6/2011 15:47,1.65,13771,United Kingdom
549153,21932,SCANDINAVIAN PAISLEY PICNIC BAG,5,4/6/2011 15:47,2.95,13771,United Kingdom
549169,85027L,FRENCH CHATEAU LARGE PLATTER ,4,4/6/2011 17:25,1.95,17906,United Kingdom
549185,22907,PACK OF 20 NAPKINS PANTRY DESIGN,12,4/7/2011 9:35,0.85,18272,United Kingdom
549188,85232D,SET/3 DECOUPAGE STACKING TINS,3,4/7/2011 10:10,4.95,13731,United Kingdom
549196,18097C,WHITE TALL PORCELAIN T-LIGHT HOLDER,6,4/7/2011 10:33,2.55,14911,EIRE
549234,20983,12 PENCILS TALL TUBE RED RETROSPOT,1,4/7/2011 11:12,0.85,16515,United Kingdom
549235,22554,PLASTERS IN TIN WOODLAND ANIMALS,3,4/7/2011 11:16,1.65,15530,United Kingdom
549238,22084,PAPER CHAIN KIT EMPIRE,6,4/7/2011 11:30,2.95,14667,United Kingdom
549238,82001S,VINYL RECORD FRAME SILVER,2,4/7/2011 11:30,3.75,14667,United Kingdom
549238,22904,CALENDAR PAPER CUT DESIGN,10,4/7/2011 11:30,2.95,14667,United Kingdom
549240,23003,TRAVEL CARD WALLET VINTAGE ROSE ,4,4/7/2011 11:37,0.42,15910,United Kingdom
549240,22966,GINGERBREAD MAN COOKIE CUTTER,4,4/7/2011 11:37,1.25,15910,United Kingdom
549241,22965,3 TRADITIONAl BISCUIT CUTTERS  SET,1,4/7/2011 11:40,2.1,15719,United Kingdom
549241,85132A,CHARLIE + LOLA BISCUITS TINS,1,4/7/2011 11:40,1.95,15719,United Kingdom
549241,22379,RECYCLING BAG RETROSPOT ,1,4/7/2011 11:40,2.1,15719,United Kingdom
549245,20914,SET/5 RED RETROSPOT LID GLASS BOWLS,1,4/7/2011 11:59,2.95,15005,United Kingdom
549250,85094,CANDY SPOT EGG WARMER RABBIT,3,4/7/2011 12:10,0.19,14446,United Kingdom
549255,71459,HANGING JAM JAR T-LIGHT HOLDER,192,4/7/2011 12:23,0.72,16209,United Kingdom
549261,22697,GREEN REGENCY TEACUP AND SAUCER,7,4/7/2011 12:35,2.95,14903,United Kingdom
549261,82494L,WOODEN FRAME ANTIQUE WHITE ,1,4/7/2011 12:35,2.95,14903,United Kingdom
549262,85099F,JUMBO BAG STRAWBERRY,2,4/7/2011 12:38,2.08,14465,United Kingdom
549274,22432,WATERING CAN PINK BUNNY,6,4/7/2011 13:07,1.95,12721,France
549274,22634,CHILDS BREAKFAST SET SPACEBOY ,2,4/7/2011 13:07,9.95,12721,France
549278,22993,SET OF 4 PANTRY JELLY MOULDS,4,4/7/2011 13:16,1.25,16255,United Kingdom
549283,20750,RED RETROSPOT MINI CASES,2,4/7/2011 13:32,7.95,13005,United Kingdom
549285,22380,TOY TIDY SPACEBOY  ,5,4/7/2011 13:45,2.1,14981,United Kingdom
549285,21980,PACK OF 12 RED RETROSPOT TISSUES ,24,4/7/2011 13:45,0.29,14981,United Kingdom
549286,22711,WRAP CIRCUS PARADE,2,4/7/2011 18:03,0.42,17928,United Kingdom
549291,82482,WOODEN PICTURE FRAME WHITE FINISH,4,4/7/2011 19:05,2.55,16261,United Kingdom
549293,84707A,SILVER JEWELLED MIRROR TRINKET TRAY,1,4/7/2011 19:16,9.95,17883,United Kingdom
549294,22971,QUEENS GUARD COFFEE MUG,1,4/7/2011 19:27,2.55,13230,United Kingdom
549294,85053,FRENCH ENAMEL CANDLEHOLDER,1,4/7/2011 19:27,2.1,13230,United Kingdom
549298,22651,GENTLEMAN SHIRT REPAIR KIT ,12,4/8/2011 8:20,0.85,13015,United Kingdom
549300,22740,POLKADOT PEN,48,4/8/2011 8:21,0.85,13362,United Kingdom
549300,22895,SET OF 2 TEA TOWELS APPLE AND PEARS,6,4/8/2011 8:21,3.25,13362,United Kingdom
549308,22727,ALARM CLOCK BAKELIKE RED ,8,4/8/2011 9:13,3.75,13767,United Kingdom
549309,22551,PLASTERS IN TIN SPACEBOY,12,4/8/2011 9:15,1.65,15114,United Kingdom
549316,22817,CARD SUKI BIRTHDAY,12,4/8/2011 9:54,0.42,12705,Germany
549316,21239,PINK  POLKADOT CUP,8,4/8/2011 9:54,0.85,12705,Germany
549321,21231,SWEETHEART CERAMIC TRINKET BOX,12,4/8/2011 10:19,1.25,14243,United Kingdom
549321,84755,COLOUR GLASS T-LIGHT HOLDER HANGING,16,4/8/2011 10:19,0.65,14243,United Kingdom
549321,48187,DOORMAT NEW ENGLAND,2,4/8/2011 10:19,7.95,14243,United Kingdom
549323,22526,WHEELBARROW FOR CHILDREN ,2,4/8/2011 10:26,12.75,12999,United Kingdom
549323,22150,3 STRIPEY MICE FELTCRAFT,6,4/8/2011 10:26,1.95,12999,United Kingdom
549324,22993,SET OF 4 PANTRY JELLY MOULDS,12,4/8/2011 10:32,1.25,16045,United Kingdom
549324,22191,IVORY DINER WALL CLOCK,2,4/8/2011 10:32,8.5,16045,United Kingdom
549325,23155,KNICKERBOCKERGLORY MAGNET ASSORTED ,12,4/8/2011 10:32,0.83,12717,Greece
549325,84836,ZINC METAL HEART DECORATION,12,4/8/2011 10:32,1.25,12717,Greece
549368,22514,CHILDS GARDEN SPADE BLUE,1,4/8/2011 11:26,2.1,18036,United Kingdom
549424,85099C,JUMBO  BAG BAROQUE BLACK WHITE,10,4/8/2011 11:50,1.95,15367,United Kingdom
549425,84692,BOX OF 24 COCKTAIL PARASOLS,8,4/8/2011 11:54,0.42,14030,United Kingdom
549429,22492,MINI PAINT SET VINTAGE ,36,4/8/2011 12:06,0.65,17001,United Kingdom
549431,15036,ASSORTED COLOURS SILK FAN,36,4/8/2011 12:17,0.83,15874,United Kingdom
549434,84279B,CHERRY BLOSSOM DECORATIVE FLASK,12,4/8/2011 12:30,3.39,12647,Germany
549435,37447,CERAMIC CAKE DESIGN SPOTTED PLATE,4,4/8/2011 12:33,1.49,12356,Portugal
549446,21981,PACK OF 12 WOODLAND TISSUES ,24,4/8/2011 13:14,0.29,17054,United Kingdom
549446,21982,PACK OF 12 SUKI TISSUES ,24,4/8/2011 13:14,0.29,17054,United Kingdom
549467,22741,FUNKY DIVA PEN,48,4/8/2011 14:26,0.85,13305,United Kingdom
549520,22178,VICTORIAN GLASS HANGING T-LIGHT,96,4/8/2011 15:19,1.06,13265,United Kingdom
549520,48187,DOORMAT NEW ENGLAND,2,4/8/2011 15:19,7.95,13265,United Kingdom
549520,22919,HERB MARKER MINT,12,4/8/2011 15:19,0.65,13265,United Kingdom
549526,21586,KINGS CHOICE GIANT TUBE MATCHES,12,4/8/2011 15:49,2.55,13630,United Kingdom
549546,20978,36 PENCILS TUBE SKULLS,16,4/10/2011 11:24,1.25,16889,United Kingdom
549546,84674,FLYING PIG WATERING CAN,3,4/10/2011 11:24,2.95,16889,United Kingdom
549547,22916,HERB MARKER THYME,12,4/10/2011 11:33,0.65,16359,United Kingdom
549548,22151,PLACE SETTING WHITE HEART,3,4/10/2011 11:35,0.42,13548,United Kingdom
549548,21157,RED RETROSPOT WASHBAG,1,4/10/2011 11:35,2.1,13548,United Kingdom
549548,22131,FOOD CONTAINER SET 3 LOVE HEART ,1,4/10/2011 11:35,1.95,13548,United Kingdom
549553,85170C,SET/6 EAU DE NIL BIRD T-LIGHTS,1,4/10/2011 12:22,2.1,16931,United Kingdom
549556,85040B,SET/4 BLUE FLOWER CANDLES IN BOWL,1,4/10/2011 12:53,1.65,17372,United Kingdom
549556,23183,MOTHER'S KITCHEN SPOON REST ,2,4/10/2011 12:53,3.75,17372,United Kingdom
549559,21217,RED RETROSPOT ROUND CAKE TINS,2,4/10/2011 13:25,9.95,12447,Belgium
549561,35095A,BLUE VICTORIAN FABRIC OVAL BOX,12,4/10/2011 13:36,0.42,13570,United Kingdom
549566,79071B,ENGLISH ROSE METAL WASTE BIN,2,4/10/2011 14:27,2.95,13610,United Kingdom
549566,22961,JAM MAKING SET PRINTED,1,4/10/2011 14:27,1.45,13610,United Kingdom
549568,84992,72 SWEETHEART FAIRY CAKE CASES,24,4/10/2011 15:09,0.55,15665,United Kingdom
549572,23154,SET OF 4 JAM JAR MAGNETS,12,4/10/2011 15:32,2.08,17757,United Kingdom
549573,21181,PLEASE ONE PERSON METAL SIGN,1,4/10/2011 16:01,2.1,14504,United Kingdom
549577,22027,TEA PARTY BIRTHDAY CARD,12,4/11/2011 8:16,0.42,14286,United Kingdom
549577,23127,FELTCRAFT GIRL NICOLE KIT,4,4/11/2011 8:16,4.95,14286,United Kingdom
549577,22550,HOLIDAY FUN LUDO,4,4/11/2011 8:16,3.75,14286,United Kingdom
549577,20983,12 PENCILS TALL TUBE RED RETROSPOT,12,4/11/2011 8:16,0.85,14286,United Kingdom
549577,22583,PACK OF 6 HANDBAG GIFT BOXES,6,4/11/2011 8:16,2.55,14286,United Kingdom
549583,22098,BOUDOIR SQUARE TISSUE BOX,12,4/11/2011 9:46,1.25,15214,United Kingdom
549587,20801,LARGE PINK GLASS SUNDAE DISH,32,4/11/2011 10:01,0.79,15737,United Kingdom
549591,22084,PAPER CHAIN KIT EMPIRE,330,4/11/2011 10:10,2.55,18080,United Kingdom
549594,85152,HAND OVER THE CHOCOLATE   SIGN ,48,4/11/2011 10:25,1.53,16029,United Kingdom
549595,22316,200 BENDY SKULL STRAWS,192,4/11/2011 10:59,1.06,13324,United Kingdom
549667,48188,DOORMAT WELCOME PUPPIES,2,4/11/2011 12:20,7.95,14911,EIRE
549667,85123A,WHITE HANGING HEART T-LIGHT HOLDER,6,4/11/2011 12:20,2.95,14911,EIRE
549687,48116,DOORMAT MULTICOLOUR STRIPE,2,4/11/2011 13:29,7.95,12363,Unspecified
549690,21976,PACK OF 60 MUSHROOM CAKE CASES,1,4/11/2011 13:41,0.55,17841,United Kingdom
549690,22978,PANTRY ROLLING PIN,1,4/11/2011 13:41,3.75,17841,United Kingdom
549694,22514,CHILDS GARDEN SPADE BLUE,2,4/11/2011 13:45,2.1,15414,United Kingdom
549716,85123A,WHITE HANGING HEART T-LIGHT HOLDER,12,4/11/2011 14:43,2.95,14628,United Kingdom
549718,23156,SET OF 5 MINI GROCERY MAGNETS,12,4/11/2011 15:03,2.08,13846,United Kingdom
549729,22189,CREAM HEART CARD HOLDER,3,4/11/2011 16:17,3.95,13634,United Kingdom
549733,84226,HEN HOUSE W FAMILY IN BARN & NEST,2,4/11/2011 16:56,0.85,17827,United Kingdom
549734,21239,PINK  POLKADOT CUP,10,4/11/2011 17:12,0.85,16409,United Kingdom
549743,22438,BALLOON ART MAKE YOUR OWN FLOWERS,10,4/12/2011 10:05,1.95,16186,United Kingdom
549745,85099B,JUMBO BAG RED RETROSPOT,10,4/12/2011 10:33,1.95,13577,United Kingdom
549746,23230,WRAP ALPHABET DESIGN,200,4/12/2011 10:38,0.34,15251,United Kingdom
549746,22584,PACK OF 6 PANNETONE GIFT BOXES,72,4/12/2011 10:38,2.55,15251,United Kingdom
549748,20914,SET/5 RED RETROSPOT LID GLASS BOWLS,32,4/12/2011 10:42,2.55,17428,United Kingdom
549751,21974,SET OF 36 PAISLEY FLOWER DOILIES,12,4/12/2011 10:58,1.45,13089,United Kingdom
549756,22801,ANTIQUE GLASS PEDESTAL BOWL,4,4/12/2011 11:36,3.75,14111,United Kingdom
549771,21114,LAVENDER SCENTED FABRIC HEART,5,4/12/2011 11:43,1.25,14669,United Kingdom
549787,21875,KINGS CHOICE MUG,6,4/12/2011 11:58,1.25,13268,United Kingdom
549787,22693,GROW A FLYTRAP OR SUNFLOWER IN TIN,24,4/12/2011 11:58,1.25,13268,United Kingdom
549826,21929,JUMBO BAG PINK VINTAGE PAISLEY,4,4/12/2011 12:53,2.08,15044,United Kingdom
549831,22423,REGENCY CAKESTAND 3 TIER,2,4/12/2011 13:10,12.75,14844,United Kingdom
549833,84970L,SINGLE HEART ZINC T-LIGHT HOLDER,12,4/12/2011 13:19,0.95,13458,United Kingdom
549835,21080,SET/20 RED RETROSPOT PAPER NAPKINS ,96,4/12/2011 13:24,0.72,17511,United Kingdom
549836,22499,WOODEN UNION JACK BUNTING,8,4/12/2011 13:32,5.95,16814,United Kingdom
549837,22189,CREAM HEART CARD HOLDER,36,4/12/2011 13:38,3.39,16705,United Kingdom
549844,21454,PAINTED PINK RABBIT ,6,4/12/2011 14:17,0.85,12854,United Kingdom
549851,22986,GINGHAM ROSE WRAP,25,4/12/2011 15:08,0.42,16062,United Kingdom
549885,22967,SET 3 SONG BIRD PAPER EGGS ASSORTED,36,4/12/2011 15:32,2.95,17204,United Kingdom
549901,21122,SET/10 PINK POLKADOT PARTY CANDLES,24,4/12/2011 16:17,1.25,17180,United Kingdom
549901,84991,60 TEATIME FAIRY CAKE CASES,4,4/12/2011 16:17,0.55,17180,United Kingdom
549904,22613,PACK OF 20 SPACEBOY NAPKINS,4,4/12/2011 16:20,0.85,17180,United Kingdom
549906,22963,JAM JAR WITH GREEN LID,6,4/12/2011 16:28,0.85,14998,United Kingdom
549911,16161U,WRAP SUKI AND FRIENDS,25,4/13/2011 8:26,0.42,14060,United Kingdom
549915,22875,NUMBER TILE COTTAGE GARDEN 7,8,4/13/2011 9:32,1.95,18231,United Kingdom
549918,21716,BOYS VINTAGE TIN SEASIDE BUCKET,8,4/13/2011 9:48,2.55,17017,United Kingdom
549923,21259,VICTORIAN SEWING BOX SMALL ,4,4/13/2011 9:59,5.95,13138,United Kingdom
549924,22423,REGENCY CAKESTAND 3 TIER,6,4/13/2011 10:10,12.75,16837,United Kingdom
549937,21756,BATH BUILDING BLOCK WORD,6,4/13/2011 11:40,5.95,15046,United Kingdom
549937,22829,SWEETHEART WIRE WALL TIDY,5,4/13/2011 11:40,9.95,15046,United Kingdom
549958,20727,LUNCH BAG  BLACK SKULL.,1,4/13/2011 13:47,1.65,17589,United Kingdom
549958,22384,LUNCH BAG PINK POLKADOT,6,4/13/2011 13:47,1.65,17589,United Kingdom
549967,82552,WASHROOM METAL SIGN,24,4/13/2011 14:21,1.45,17873,United Kingdom
549969,23201,JUMBO BAG ALPHABET,100,4/13/2011 14:24,1.65,13408,United Kingdom
549977,22728,ALARM CLOCK BAKELIKE PINK,2,4/13/2011 14:54,3.75,14810,United Kingdom
549980,21175,GIN + TONIC DIET METAL SIGN,24,4/13/2011 15:36,2.55,14062,United Kingdom
549980,21166,COOK WITH WINE METAL SIGN ,24,4/13/2011 15:36,2.08,14062,United Kingdom
549983,46000S,POLYESTER FILLER PAD 40x40cm,2,4/13/2011 15:55,1.45,16348,United Kingdom
549985,23254,CHILDRENS CUTLERY DOLLY GIRL ,4,4/13/2011 15:58,4.15,15640,United Kingdom
549989,84987,SET OF 36 TEATIME PAPER DOILIES,1,4/13/2011 16:58,1.45,13221,United Kingdom
549995,22076,6 RIBBONS EMPIRE  ,24,4/14/2011 8:32,1.65,16131,United Kingdom
549995,21982,PACK OF 12 SUKI TISSUES ,24,4/14/2011 8:32,0.29,16131,United Kingdom
549999,22698,PINK REGENCY TEACUP AND SAUCER,24,4/14/2011 9:09,2.55,15813,United Kingdom
550006,22692,DOORMAT WELCOME TO OUR HOME,1,4/14/2011 10:10,7.95,17841,United Kingdom
550008,22722,SET OF 6 SPICE TINS PANTRY DESIGN,4,4/14/2011 10:17,3.95,15570,United Kingdom
550016,22367,CHILDRENS APRON SPACEBOY DESIGN,8,4/14/2011 10:54,1.95,15416,United Kingdom
550034,22499,WOODEN UNION JACK BUNTING,3,4/14/2011 11:48,5.95,16187,United Kingdom
550035,21080,SET/20 RED RETROSPOT PAPER NAPKINS ,12,4/14/2011 11:48,0.85,15039,United Kingdom
550035,15056BL,EDWARDIAN PARASOL BLACK,2,4/14/2011 11:48,5.95,15039,United Kingdom
550052,22380,TOY TIDY SPACEBOY  ,5,4/14/2011 12:00,2.1,17068,United Kingdom
550120,23204,CHARLOTTE BAG APPLES DESIGN,10,4/14/2011 12:35,0.85,17071,United Kingdom
550132,22815,CARD PSYCHEDELIC APPLES,36,4/14/2011 13:33,0.42,16933,United Kingdom
550134,21977,PACK OF 60 PINK PAISLEY CAKE CASES,24,4/14/2011 13:50,0.55,16249,United Kingdom
550134,21716,BOYS VINTAGE TIN SEASIDE BUCKET,32,4/14/2011 13:50,2.1,16249,United Kingdom
550137,22070,SMALL RED RETROSPOT MUG IN BOX ,6,4/14/2011 13:59,3.75,12477,Germany
550138,22907,PACK OF 20 NAPKINS PANTRY DESIGN,4,4/14/2011 14:02,0.85,12841,United Kingdom
550144,22773,GREEN DRAWER KNOB ACRYLIC EDWARDIAN,2,4/14/2011 14:14,1.25,16520,United Kingdom
550145,22962,JAM JAR WITH PINK LID,12,4/14/2011 14:15,0.85,12637,France
550157,22384,LUNCH BAG PINK POLKADOT,2,4/14/2011 15:26,1.65,16393,United Kingdom
550159,85152,HAND OVER THE CHOCOLATE   SIGN ,48,4/14/2011 15:46,1.85,14062,United Kingdom
550163,21716,BOYS VINTAGE TIN SEASIDE BUCKET,8,4/14/2011 16:26,2.55,14154,United Kingdom
550173,22693,GROW A FLYTRAP OR SUNFLOWER IN TIN,24,4/14/2011 16:58,1.25,15235,United Kingdom
550178,20712,JUMBO BAG WOODLAND ANIMALS,20,4/14/2011 17:25,2.08,12662,Germany
550179,22904,CALENDAR PAPER CUT DESIGN,6,4/14/2011 17:29,2.95,15220,United Kingdom
550183,84987,SET OF 36 TEATIME PAPER DOILIES,12,4/14/2011 17:58,1.45,14105,United Kingdom
550184,22438,BALLOON ART MAKE YOUR OWN FLOWERS,2,4/14/2011 18:02,1.95,17601,United Kingdom
550184,84569D,PACK 6 HEART/ICE-CREAM PATCHES,6,4/14/2011 18:02,1.25,17601,United Kingdom
550191,20803,SMALL PINK GLASS SUNDAE DISH,6,4/14/2011 19:59,0.39,16806,United Kingdom
550192,21394,RED POLKADOT BEAKER ,48,4/15/2011 8:45,0.39,12582,Finland
550196,23156,SET OF 5 MINI GROCERY MAGNETS,1,4/15/2011 10:09,2.08,14796,United Kingdom
550196,22055,MINI CAKE STAND  HANGING STRAWBERY,1,4/15/2011 10:09,1.65,14796,United Kingdom
550196,21977,PACK OF 60 PINK PAISLEY CAKE CASES,2,4/15/2011 10:09,0.55,14796,United Kingdom
550196,22295,HEART FILIGREE DOVE LARGE,2,4/15/2011 10:09,1.65,14796,United Kingdom
550201,22722,SET OF 6 SPICE TINS PANTRY DESIGN,24,4/15/2011 10:25,3.45,12769,Brazil
550272,22996,TRAVEL CARD WALLET VINTAGE TICKET,480,4/15/2011 12:14,0.36,18079,United Kingdom
550272,22207,FRYING PAN UNION FLAG,1,4/15/2011 12:14,4.25,18079,United Kingdom
550274,22088,PAPER BUNTING COLOURED LACE,6,4/15/2011 12:23,2.95,15498,United Kingdom
550274,22911,PAPER CHAIN KIT LONDON,6,4/15/2011 12:23,2.95,15498,United Kingdom
550275,22960,JAM MAKING SET WITH JARS,6,4/15/2011 12:35,4.25,13993,United Kingdom
550276,21137,BLACK RECORD COVER FRAME,24,4/15/2011 12:48,3.39,12989,United Kingdom
550277,21124,SET/10 BLUE POLKADOT PARTY CANDLES,24,4/15/2011 12:48,1.25,12639,Sweden
550279,21669,BLUE STRIPE CERAMIC DRAWER KNOB,12,4/15/2011 13:16,1.25,14700,United Kingdom
550279,22526,WHEELBARROW FOR CHILDREN ,2,4/15/2011 13:16,12.75,14700,United Kingdom
550279,22088,PAPER BUNTING COLOURED LACE,7,4/15/2011 13:16,2.95,14700,United Kingdom
550280,23201,JUMBO BAG ALPHABET,10,4/15/2011 13:31,2.08,13048,United Kingdom
550284,22894,TABLECLOTH RED APPLES DESIGN ,2,4/15/2011 14:10,9.95,12383,Belgium
550288,35924,HANGING FAIRY CAKE DECORATION,2,4/15/2011 14:21,2.1,17367,United Kingdom
550290,22804,CANDLEHOLDER PINK HANGING HEART,6,4/15/2011 14:45,2.95,15246,United Kingdom
550292,47566,PARTY BUNTING,3,4/15/2011 15:31,4.95,14527,United Kingdom
550298,21326,AGED GLASS SILVER T-LIGHT HOLDER,12,4/15/2011 16:11,0.65,17346,United Kingdom
550302,23176,ABC TREASURE BOOK BOX ,8,4/17/2011 10:17,2.25,14156,EIRE
550302,21533,RETROSPOT LARGE MILK JUG,3,4/17/2011 10:17,4.95,14156,EIRE
550314,21878,PACK OF 6 SANDCASTLE FLAGS ASSORTED,1,4/17/2011 11:30,0.85,16905,United Kingdom
550319,15058A,BLUE POLKADOT GARDEN PARASOL,2,4/17/2011 12:37,7.95,14524,United Kingdom
550320,22775,PURPLE DRAWERKNOB ACRYLIC EDWARDIAN,6,4/17/2011 12:38,1.25,12748,United Kingdom
550320,22567,20 DOLLY PEGS RETROSPOT,3,4/17/2011 12:37,1.45,12748,United Kingdom
550321,20972,PINK CREAM FELT CRAFT TRINKET BOX ,2,4/17/2011 12:49,1.25,16770,United Kingdom
550323,84879,ASSORTED COLOUR BIRD ORNAMENT,48,4/17/2011 12:57,1.69,13692,United Kingdom
550329,22693,GROW A FLYTRAP OR SUNFLOWER IN TIN,24,4/17/2011 13:20,1.25,13951,United Kingdom
550329,22179,SET 10 LIGHTS NIGHT OWL,2,4/17/2011 13:20,6.75,13951,United Kingdom
550331,85203,HANGING WOOD AND FELT BUTTERFLY ,1,4/17/2011 13:43,0.42,15555,United Kingdom
550331,22989,SET 2 PANTRY DESIGN TEA TOWELS,2,4/17/2011 13:43,3.25,15555,United Kingdom
550331,84535A,ENGLISH ROSE NOTEBOOK A6 SIZE,6,4/17/2011 13:43,0.65,15555,United Kingdom
550332,82613B,"METAL SIGN,CUPCAKE SINGLE HOOK",1,4/17/2011 13:53,1.25,13474,United Kingdom
550332,22602,RETROSPOT WOODEN HEART DECORATION,2,4/17/2011 13:53,0.85,13474,United Kingdom
550332,37449,CERAMIC CAKE STAND + HANGING CAKES,1,4/17/2011 13:53,9.95,13474,United Kingdom
550332,21212,PACK OF 72 RETROSPOT CAKE CASES,1,4/17/2011 13:53,0.55,13474,United Kingdom
550334,21179,NO JUNK MAIL METAL SIGN,24,4/17/2011 14:09,1.25,17320,United Kingdom
550359,23256,CHILDRENS CUTLERY SPACEBOY ,1,4/18/2011 10:41,4.15,17841,United Kingdom
550389,22900, SET 2 TEA TOWELS I LOVE LONDON ,3,4/18/2011 11:53,3.25,17284,United Kingdom
550408,47591D,PINK FAIRY CAKE CHILDRENS APRON,2,4/18/2011 11:59,1.95,16746,United Kingdom
550437,22193,RED DINER WALL CLOCK,1,4/18/2011 12:14,8.5,16923,United Kingdom
550437,21200,MULTICOLOUR HONEYCOMB PAPER GARLAND,2,4/18/2011 12:14,1.65,16923,United Kingdom
550437,21205,MULTICOLOUR 3D BALLS GARLAND,1,4/18/2011 12:14,2.55,16923,United Kingdom
550438,21232,STRAWBERRY CERAMIC TRINKET BOX,12,4/18/2011 12:16,1.25,15265,United Kingdom
550439,22674,FRENCH TOILET SIGN BLUE METAL,6,4/18/2011 12:17,1.25,18231,United Kingdom
550439,21755,LOVE BUILDING BLOCK WORD,3,4/18/2011 12:17,5.95,18231,United Kingdom
550440,22635,CHILDS BREAKFAST SET DOLLY GIRL ,4,4/18/2011 12:25,9.95,12407,Belgium
550440,23077,DOUGHNUT LIP GLOSS ,20,4/18/2011 12:25,1.25,12407,Belgium
550446,20724,RED RETROSPOT CHARLOTTE BAG,10,4/18/2011 12:36,0.85,13871,United Kingdom
550446,21481,FAWN BLUE HOT WATER BOTTLE,6,4/18/2011 12:36,2.95,13871,United Kingdom
550447,23194,GYMKHANA TREASURE BOOK BOX,1,4/18/2011 12:36,2.25,16033,United Kingdom
550447,22384,LUNCH BAG PINK POLKADOT,2,4/18/2011 12:36,1.65,16033,United Kingdom
550457,84380,SET OF 3 BUTTERFLY COOKIE CUTTERS,144,4/18/2011 13:12,1.06,13798,United Kingdom
550467,16016,LARGE CHINESE STYLE SCISSOR,3,4/18/2011 13:36,0.85,18009,United Kingdom
550469,22301,COFFEE MUG CAT + BIRD DESIGN,6,4/18/2011 13:46,2.55,16399,United Kingdom
550469,22557,PLASTERS IN TIN VINTAGE PAISLEY ,2,4/18/2011 13:46,1.65,16399,United Kingdom
550477,21683,MEDIUM MEDINA STAMPED METAL BOWL ,3,4/18/2011 14:01,2.95,17338,United Kingdom
550477,22659,LUNCH BOX I LOVE LONDON,3,4/18/2011 14:01,1.95,17338,United Kingdom
550477,22219,LOVEBIRD HANGING DECORATION WHITE ,4,4/18/2011 14:01,0.85,17338,United Kingdom
550477,21975,PACK OF 60 DINOSAUR CAKE CASES,1,4/18/2011 14:01,0.55,17338,United Kingdom
550477,21577,SAVE THE PLANET COTTON TOTE BAG,3,4/18/2011 14:01,2.25,17338,United Kingdom
550478,22084,PAPER CHAIN KIT EMPIRE,6,4/18/2011 14:01,2.95,15755,United Kingdom
550479,21703,BAG 125g SWIRLY MARBLES,48,4/18/2011 14:01,0.42,15625,United Kingdom
550480,22522,CHILDS GARDEN FORK BLUE ,4,4/18/2011 14:05,0.85,13069,United Kingdom
550480,20677,PINK POLKADOT BOWL,4,4/18/2011 14:05,1.25,13069,United Kingdom
550480,37475,SET/4 COLOURFUL MIXING BOWLS,1,4/18/2011 14:05,9.95,13069,United Kingdom
550488,22060,LARGE CAKE STAND HANGING HEARTS,3,4/18/2011 14:27,3.95,16729,United Kingdom
550503,21845,DAIRY MAID STRIPE MUG,36,4/18/2011 15:31,0.79,15508,United Kingdom
550503,85099B,JUMBO BAG RED RETROSPOT,10,4/18/2011 15:31,2.08,15508,United Kingdom
550512,22031,BOTANICAL LAVENDER BIRTHDAY CARD,12,4/18/2011 16:31,0.42,18069,United Kingdom
550512,22672,FRENCH BATHROOM SIGN BLUE METAL,1,4/18/2011 16:31,1.65,18069,United Kingdom
550512,22162,HEART GARLAND RUSTIC PADDED,1,4/18/2011 16:31,2.95,18069,United Kingdom
550515,22196,SMALL HEART MEASURING SPOONS,2,4/18/2011 17:29,0.85,14502,United Kingdom
550515,21447,12 IVORY ROSE PEG PLACE SETTINGS,2,4/18/2011 17:29,1.25,14502,United Kingdom
550517,84879,ASSORTED COLOUR BIRD ORNAMENT,8,4/19/2011 8:17,1.69,14352,United Kingdom
550517,22088,PAPER BUNTING COLOURED LACE,12,4/19/2011 8:17,2.95,14352,United Kingdom
550519,22520,CHILDS GARDEN TROWEL BLUE ,12,4/19/2011 9:31,0.85,13141,United Kingdom
550519,21559,STRAWBERRY LUNCH BOX WITH CUTLERY,6,4/19/2011 9:31,2.55,13141,United Kingdom
550521,84879,ASSORTED COLOUR BIRD ORNAMENT,8,4/19/2011 9:49,1.69,13647,United Kingdom
550522,21222,SET/4 BADGES BEETLES,10,4/19/2011 10:04,1.25,12947,United Kingdom
550522,22139,RETROSPOT TEA SET CERAMIC 11 PC ,3,4/19/2011 10:04,4.95,12947,United Kingdom
550526,22976,CIRCUS PARADE CHILDRENS EGG CUP ,12,4/19/2011 10:40,1.25,14309,United Kingdom
550527,22722,SET OF 6 SPICE TINS PANTRY DESIGN,4,4/19/2011 10:48,3.95,12476,Germany
550527,22702,BLACK AND WHITE CAT BOWL,6,4/19/2011 10:48,2.1,12476,Germany
550527,84849D,HOT BATHS SOAP HOLDER,12,4/19/2011 10:48,1.69,12476,Germany
550527,22849,BREAD BIN DINER STYLE MINT,4,4/19/2011 10:48,14.95,12476,Germany
550532,20975,12 PENCILS SMALL TUBE RED RETROSPOT,4,4/19/2011 11:02,0.65,14606,United Kingdom
550607,22660,DOORMAT I LOVE LONDON,2,4/19/2011 12:17,7.95,16919,United Kingdom
550618,84880,WHITE WIRE EGG HOLDER,3,4/19/2011 13:09,7.5,14156,EIRE
550618,22329,ROUND CONTAINER SET OF 5 RETROSPOT,12,4/19/2011 13:09,1.65,14156,EIRE
550620,23126,FELTCRAFT GIRL AMELIE KIT,4,4/19/2011 13:39,4.95,12585,Germany
550622,21715,GIRLS VINTAGE TIN SEASIDE BUCKET,12,4/19/2011 13:49,2.55,13735,United Kingdom
550627,22607,WOODEN ROUNDERS GARDEN SET ,2,4/19/2011 14:36,9.95,16633,United Kingdom
550630,79051A,SMOKEY GREY COLOUR D.O.F. GLASS,24,4/19/2011 14:49,0.29,14298,United Kingdom
550630,84576,BLUE CAT BISCUIT BARREL PINK HEART,12,4/19/2011 14:49,1.95,14298,United Kingdom
550630,37342,POLKADOT COFFEE CUP & SAUCER PINK,24,4/19/2011 14:49,0.79,14298,United Kingdom
550631,22672,FRENCH BATHROOM SIGN BLUE METAL,12,4/19/2011 14:51,1.65,15225,United Kingdom
550637,23255,CHILDRENS CUTLERY CIRCUS PARADE,2,4/19/2011 15:39,4.15,14415,United Kingdom
550645,22381,TOY TIDY PINK POLKADOT,10,4/19/2011 16:31,2.1,16098,United Kingdom
550645,22730,ALARM CLOCK BAKELIKE IVORY,3,4/19/2011 16:30,3.75,16098,United Kingdom
550651,22980,PANTRY SCRUBBING BRUSH,2,4/19/2011 16:52,1.65,15436,United Kingdom
550651,20725,LUNCH BAG RED RETROSPOT,1,4/19/2011 16:52,1.65,15436,United Kingdom
550655,85032D,YULETIDE IMAGES GIFT WRAP SET,1,4/19/2011 17:19,2.1,17217,United Kingdom
550656,47590A,BLUE HAPPY BIRTHDAY BUNTING,3,4/20/2011 8:07,5.45,17652,United Kingdom
550659,84991,60 TEATIME FAIRY CAKE CASES,24,4/20/2011 9:02,0.55,17730,United Kingdom
550659,21790,VINTAGE SNAP CARDS,24,4/20/2011 9:02,0.85,17730,United Kingdom
550661,22326,ROUND SNACK BOXES SET OF4 WOODLAND ,12,4/20/2011 9:20,2.95,12656,France
550662,22663,JUMBO BAG DOLLY GIRL DESIGN,10,4/20/2011 9:29,2.08,15078,United Kingdom
550662,85014B,RED RETROSPOT UMBRELLA,4,4/20/2011 9:29,5.95,15078,United Kingdom
550670,23049,RECYCLED ACAPULCO MAT RED,2,4/20/2011 10:04,8.25,17734,United Kingdom
550712,22972,CHILDREN'S SPACEBOY MUG,12,4/20/2011 11:06,1.65,15159,United Kingdom
